### ISSUE TITLE
Multicast stopped working

### ISSUE THREAD

**Issue by ROosterloo1988** [fabianishere/udm-iptv#408]
Hello,

When i look normal tv it works fine. If i watch longer time to a streaming service and switch to tv then it stop working after 30 minutes. When i change the decoder to unicast with this problem it works after switching and then we can change it back to multicast everything still works..

What can i change?

**Comment by erikpost** [comment]
You need to provide more info on your setup and configuration for anybody to be able to help you.

* what does your network setup look like (which Unifi Gateway model, switches, etc)
* what version of Unifi OS and Network Application are you running
* how have you configured your VLAN
* what internet provider, IPTV service and STB model
* is the STB connected directly to the gateway or to a switch
* provide the output of `udm-iptv diagnose`
* provide the contents of your configuration file `/etc/udm-iptv.conf`

**Comment by ROosterloo1988** [comment]
1. Unifi UXG Lite -> us 16 poe 150w ->  usw lite 8 poe

2. 9.3.45 network Application, uxg lite 4.1.13, us16 7.1.26, usw lite 7.1.26

3. Different vlan for iptv where only the 2 boxes lives in.

4. KPN Netherlands , 2x kpn+ stb; 1 is directly connected through us16 and 1 is connected through usw lite

5. Next-GenerationGatewayLite:~# udm-iptv diagnose
Please share the following output with the developers:
=== Configuration ===
WAN Interface: eth1
WAN VLAN: 4 (dev iptv)
WAN DHCP: true (options "-O staticroutes -V IPTV_RG")
WAN Ranges: 213.75.0.0/16  217.166.0.0/16  195.121.0.0/16
LAN Interfaces: br21
IGMP Proxy quickleave disabled: true
IGMP Proxy debug: true
=== IP Link and Route ===
22: iptv@eth1: <BROADCAST,MULTICAST,UP,LOWER_UP> mtu 1500 qdisc noqueue state UP group default qlen 1000
    inet 10.35.53.201/22 brd 10.35.55.255 scope global iptv
       valid_lft forever preferred_lft forever
10.35.52.0/22 proto kernel scope link src 10.35.53.201
213.75.112.0/21 via 10.35.52.1 metric 222
=== Service Logs ===
Aug 10 20:10:01 Next-GenerationGatewayLite udm-iptvd[2692]: WARNING[mcast_recv_igmp@759]: Don't exist this Downstream VIF
Aug 10 20:10:01 Next-GenerationGatewayLite udm-iptvd[2692]: DEBUG[main@655]: timeoutAug 10 20:10:01 Next-GenerationGatewayLite udm-iptvd[2692]: DEBUG[general_queries_timer_handler@810]: Enter
Aug 10 20:10:01 Next-GenerationGatewayLite udm-iptvd[2692]: DEBUG[send_igmp_mld_query@101]: src = 172.16.210.1 dst = 224.0.0.1
Aug 10 20:10:01 Next-GenerationGatewayLite udm-iptvd[2692]: DEBUG[send_igmp_mld_query@104]: max_len = 1476
Aug 10 20:10:01 Next-GenerationGatewayLite udm-iptvd[2692]: DEBUG[send_igmp_mld_query@155]: igh_len  = 8
Aug 10 20:10:01 Next-GenerationGatewayLite udm-iptvd[2692]: DEBUG[main@653]: Data arrive
Aug 10 20:10:01 Next-GenerationGatewayLite udm-iptvd[2692]: DEBUG[mcast_recv_igmp@748]: src addr = 172.16.210.180
Aug 10 20:10:01 Next-GenerationGatewayLite udm-iptvd[2692]: received interface  19
Aug 10 20:10:01 Next-GenerationGatewayLite udm-iptvd[2692]: DEBUG[imp_input_report_v1v2@289]: group address 239.255.255.250

6. Next-GenerationGatewayLite:~# cat /etc/udm-iptv.conf
## Example configuration for udmp-iptv ##
# Interface on which IPTV traffic enters the router
IPTV_WAN_INTERFACE="eth1"
# ID of VLAN which carries IPTV traffic (use 0 if no VLAN is used)
IPTV_WAN_VLAN="4"
# Name of the IPTV VLAN interface
IPTV_WAN_VLAN_INTERFACE="iptv"
# IP ranges from which the IPTV traffic originates (separated by spaces)
IPTV_WAN_RANGES="213.75.0.0/16  217.166.0.0/16  195.121.0.0/16"
# DHCP options to send when requesting an IP address
IPTV_WAN_DHCP_OPTIONS="-O staticroutes -V IPTV_RG"
# LAN interfaces on which IPTV should be made available
IPTV_LAN_INTERFACES="br21"
# Disable quickleave for igmpproxy
IPTV_IGMPPROXY_DISABLE_QUICKLEAVE="true"
# Enable debugging for igmpproxy
IPTV_IGMPPROXY_DEBUG="true"
IPTV_IGMPPROXY_PROGRAM="improxy"
IPTV_IGMPPROXY_IGMP_VERSION="2"

**Comment by erikpost** [comment]
Edit: because you use two STBs, you need to set `IPTV_IGMPPROXY_DISABLE_QUICKLEAVE` to `true`. This may already solve your issue. This setting makes sure that the an STB keeps receiving the multicast traffic when the other one leaves the multicast group (eg by switching to a different channel or from TV to a streaming app).

And some other checks:

Do you have IGMP snooping enabled for your local IPTV VLAN in Network Application?

And does the issue also happen if you switch to igmpproxy instead of improxy? You can do this by installing the igmpproxy package (`apt install igmpproxy`), setting `IPTV_IGMPPROXY_PROGRAM` to `igmpproxy` and then restarting the udm-iptv script with `systemctl restart igmpproxy`.

**Comment by ROosterloo1988** [comment]
> Edit: because you use two STBs, you need to set `IPTV_IGMPPROXY_DISABLE_QUICKLEAVE` to `true`. This may already solve your issue. This setting makes sure that the an STB keeps receiving the multicast traffic when the other one leaves the multicast group (eg by switching to a different channel or from TV to a streaming app).
> 
> And some other checks:
> 
> Do you have IGMP snooping enabled for your local IPTV VLAN in Network Application?
> 
> And does the issue also happen if you switch to igmpproxy instead of improxy? You can do this by installing the igmpproxy package (`apt install igmpproxy`), setting `IPTV_IGMPPROXY_PROGRAM` to `igmpproxy` and then restarting the udm-iptv script with `systemctl restart igmpproxy`.
> 
> 


Not solved

Please share the following output with the developers:
=== Configuration ===
WAN Interface: eth1
WAN VLAN: 4 (dev iptv)
WAN DHCP: true (options "-O staticroutes -V IPTV_RG")
WAN Ranges: 213.75.0.0/16  217.166.0.0/16  195.121.0.0/16
LAN Interfaces: br21
IGMP Proxy quickleave disabled: false
IGMP Proxy debug: true
=== IP Link and Route ===
25: iptv@eth1: <BROADCAST,MULTICAST,UP,LOWER_UP> mtu 1500 qdisc noqueue state UP group default qlen 1000
    inet 10.35.52.205/22 brd 10.35.55.255 scope global iptv
       valid_lft forever preferred_lft forever
10.35.52.0/22 proto kernel scope link src 10.35.52.205
213.75.112.0/21 via 10.35.52.1 metric 225
=== Service Logs ===
Aug 15 18:52:48 Next-GenerationGatewayLite udm-iptvd[2867]: DEBUG[main@655]: timeoutAug 15 18:52:48 Next-GenerationGatewayLite udm-iptvd[2867]: DEBUG[main@655]: timeoutAug 15 18:52:48 Next-GenerationGatewayLite udm-iptvd[2867]: DEBUG[main@655]: timeoutAug 15 18:52:48 Next-GenerationGatewayLite udm-iptvd[2867]: DEBUG[main@655]: timeoutAug 15 18:52:48 Next-GenerationGatewayLite udm-iptvd[2867]: DEBUG[main@655]: timeoutAug 15 18:52:48 Next-GenerationGatewayLite udm-iptvd[2867]: DEBUG[main@655]: timeoutAug 15 18:52:48 Next-GenerationGatewayLite udm-iptvd[2867]: DEBUG[main@655]: timeoutAug 15 18:52:48 Next-GenerationGatewayLite udm-iptvd[2867]: DEBUG[general_queries_timer_handler@810]: Enter
Aug 15 18:52:48 Next-GenerationGatewayLite udm-iptvd[2867]: DEBUG[send_igmp_mld_query@101]: src = 172.16.210.1 dst = 224.0.0.1
Aug 15 18:52:48 Next-GenerationGatewayLite udm-iptvd[2867]: DEBUG[send_igmp_mld_query@104]: max_len = 1476

**Comment by larscom** [comment]
have you tried changing the WAN ranges to see if it works?

`IPTV_WAN_RANGES="0.0.0.0/0"`

and

`IPTV_IGMPPROXY_DISABLE_QUICKLEAVE="true"`

**Comment by ROosterloo1988** [comment]
> have you tried changing the WAN ranges to see if it works?
> 
> `IPTV_WAN_RANGES="0.0.0.0/0"`
> 
> and
> 
> `IPTV_IGMPPROXY_DISABLE_QUICKLEAVE="true"`

Same problem:

Please share the following output with the developers:
=== Configuration ===
WAN Interface: eth1
WAN VLAN: 4 (dev iptv)
WAN DHCP: true (options "-O staticroutes -V IPTV_RG")
WAN Ranges: 0.0.0.0/0
LAN Interfaces: br21
IGMP Proxy quickleave disabled: true
IGMP Proxy debug: true
=== IP Link and Route ===
25: iptv@eth1: <BROADCAST,MULTICAST,UP,LOWER_UP> mtu 1500 qdisc noqueue state UP group default qlen 1000
    inet 10.143.188.34/22 brd 10.143.191.255 scope global iptv
       valid_lft forever preferred_lft forever
10.143.188.0/22 proto kernel scope link src 10.143.188.34
213.75.112.0/21 via 10.143.188.1 metric 225
=== Service Logs ===
Aug 17 21:00:57 Next-GenerationGatewayLite udm-iptvd[5145]: DEBUG[main@655]: timeoutAug 17 21:00:57 Next-GenerationGatewayLite udm-iptvd[5145]: DEBUG[main@655]: timeoutAug 17 21:00:57 Next-GenerationGatewayLite udm-iptvd[5145]: DEBUG[main@655]: timeoutAug 17 21:00:57 Next-GenerationGatewayLite udm-iptvd[5145]: DEBUG[main@655]: timeoutAug 17 21:00:57 Next-GenerationGatewayLite udm-iptvd[5145]: DEBUG[main@655]: timeoutAug 17 21:00:57 Next-GenerationGatewayLite udm-iptvd[5145]: DEBUG[general_queries_timer_handler@810]: Enter
Aug 17 21:00:57 Next-GenerationGatewayLite udm-iptvd[5145]: DEBUG[send_igmp_mld_query@101]: src = 172.16.210.1 dst = 224.0.0.1
Aug 17 21:00:57 Next-GenerationGatewayLite udm-iptvd[5145]: DEBUG[send_igmp_mld_query@104]: max_len = 1476
Aug 17 21:00:57 Next-GenerationGatewayLite udm-iptvd[5145]: DEBUG[send_igmp_mld_query@155]: igh_len  = 8
Aug 17 21:00:57 Next-GenerationGatewayLite udm-iptvd[5145]: DEBUG[main@655]: timeout

**Comment by larscom** [comment]
I would ssh into the UXG and execute: `journalctl -u udm-iptv -f` and keep it open.

What do you see when the tv stop working?

**Comment by ROosterloo1988** [comment]
Aug 24 14:26:16 Next-GenerationGatewayLite udm-iptvd[2888]: DEBUG[main@653]: Data arrive
Aug 24 14:26:16 Next-GenerationGatewayLite udm-iptvd[2888]: DEBUG[mcast_recv_igmp@748]: src addr = 172.16.210.180
Aug 24 14:26:16 Next-GenerationGatewayLite udm-iptvd[2888]: received interface  19
Aug 24 14:26:16 Next-GenerationGatewayLite udm-iptvd[2888]: DEBUG[imp_input_report_v1v2@289]: group address 239.255.255.250
Aug 24 14:36:34 Next-GenerationGatewayLite udm-iptvd[2888]: INFO[imp_verify_multicast_addr@262]: Group address 239.255.255.250 belongs to IPv4 Local Scope.
Aug 24 14:36:34 Next-GenerationGatewayLite udm-iptvd[2888]: DEBUG[main@653]: Data arrive
Aug 24 14:36:34 Next-GenerationGatewayLite udm-iptvd[2888]: DEBUG[mcast_recv_igmp@748]: src addr = 172.16.210.44
Aug 24 14:36:34 Next-GenerationGatewayLite udm-iptvd[2888]: received interface  19
Aug 24 14:36:34 Next-GenerationGatewayLite udm-iptvd[2888]: DEBUG[imp_input_report_v1v2@289]: group address 239.255.255.250
Aug 24 14:36:34 Next-GenerationGatewayLite udm-iptvd[2888]: INFO[imp_verify_multicast_addr@262]: Group address 239.255.255.250 belongs to IPv4 Local Scope.
Aug 24 14:36:34 Next-GenerationGatewayLite udm-iptvd[2888]: DEBUG[main@655]: timeoutAug 24 14:36:34 Next-GenerationGatewayLite udm-iptvd[2888]: DEBUG[general_queries_timer_handler@810]: Enter
Aug 24 14:36:34 Next-GenerationGatewayLite udm-iptvd[2888]: DEBUG[send_igmp_mld_query@101]: src = 172.16.210.1 dst = 224.0.0.1
Aug 24 14:36:34 Next-GenerationGatewayLite udm-iptvd[2888]: DEBUG[send_igmp_mld_query@104]: max_len = 1476
Aug 24 14:36:34 Next-GenerationGatewayLite udm-iptvd[2888]: DEBUG[send_igmp_mld_query@155]: igh_len  = 8
Aug 24 14:36:34 Next-GenerationGatewayLite udm-iptvd[2888]: DEBUG[main@653]: Data arrive
Aug 24 14:36:34 Next-GenerationGatewayLite udm-iptvd[2888]: DEBUG[mcast_recv_igmp@748]: src addr = 172.16.210.44
Aug 24 14:36:34 Next-GenerationGatewayLite udm-iptvd[2888]: received interface  19
Aug 24 14:36:34 Next-GenerationGatewayLite udm-iptvd[2888]: DEBUG[imp_input_report_v1v2@289]: group address 239.255.255.250
Aug 24 14:36:34 Next-GenerationGatewayLite udm-iptvd[2888]: INFO[imp_verify_multicast_addr@262]: Group address 239.255.255.250 belongs to IPv4 Local Scope.
Aug 24 14:36:34 Next-GenerationGatewayLite udm-iptvd[2888]: DEBUG[main@653]: Data arrive
Aug 24 14:36:34 Next-GenerationGatewayLite udm-iptvd[2888]: DEBUG[mcast_recv_igmp@748]: src addr = 10.60.199.21
Aug 24 14:36:34 Next-GenerationGatewayLite udm-iptvd[2888]: received interface  25
Aug 24 14:36:34 Next-GenerationGatewayLite udm-iptvd[2888]: WARNING[mcast_recv_igmp@759]: Don't exist this Downstream VIF
Aug 24 14:36:34 Next-GenerationGatewayLite udm-iptvd[2888]: DEBUG[main@653]: Data arrive
Aug 24 14:36:34 Next-GenerationGatewayLite udm-iptvd[2888]: DEBUG[mcast_recv_igmp@748]: src addr = 172.16.210.180
Aug 24 14:36:34 Next-GenerationGatewayLite udm-iptvd[2888]: received interface  19
Aug 24 14:36:34 Next-GenerationGatewayLite udm-iptvd[2888]: DEBUG[imp_input_report_v1v2@289]: group address 239.255.255.250
Aug 24 14:36:34 Next-GenerationGatewayLite udm-iptvd[2888]: INFO[imp_verify_multicast_addr@262]: Group address 239.255.255.250 belongs to IPv4 Local Scope.
Aug 24 14:36:34 Next-GenerationGatewayLite udm-iptvd[2888]: DEBUG[main@655]: timeoutAug 24 14:36:34 Next-GenerationGatewayLite udm-iptvd[2888]: DEBUG[general_queries_timer_handler@810]: Enter
Aug 24 14:36:34 Next-GenerationGatewayLite udm-iptvd[2888]: DEBUG[send_igmp_mld_query@101]: src = 172.16.210.1 dst = 224.0.0.1
Aug 24 14:36:34 Next-GenerationGatewayLite udm-iptvd[2888]: DEBUG[send_igmp_mld_query@104]: max_len = 1476
Aug 24 14:36:34 Next-GenerationGatewayLite udm-iptvd[2888]: DEBUG[send_igmp_mld_query@155]: igh_len  = 8
Aug 24 14:36:34 Next-GenerationGatewayLite udm-iptvd[2888]: DEBUG[main@653]: Data arrive
Aug 24 14:36:34 Next-GenerationGatewayLite udm-iptvd[2888]: DEBUG[mcast_recv_igmp@748]: src addr = 172.16.210.44
Aug 24 14:36:34 Next-GenerationGatewayLite udm-iptvd[2888]: received interface  19
Aug 24 14:36:34 Next-GenerationGatewayLite udm-iptvd[2888]: DEBUG[imp_input_report_v1v2@289]: group address 239.255.255.250
Aug 24 14:36:34 Next-GenerationGatewayLite udm-iptvd[2888]: INFO[imp_verify_multicast_addr@262]: Group address 239.255.255.250 belongs to IPv4 Local Scope.
Aug 24 14:36:34 Next-GenerationGatewayLite udm-iptvd[2888]: DEBUG[main@653]: Data arrive
Aug 24 14:36:34 Next-GenerationGatewayLite udm-iptvd[2888]: DEBUG[mcast_recv_igmp@748]: src addr = 172.16.210.180
Aug 24 14:36:34 Next-GenerationGatewayLite udm-iptvd[2888]: received interface  19
Aug 24 14:36:34 Next-GenerationGatewayLite udm-iptvd[2888]: DEBUG[imp_input_report_v1v2@289]: group address 239.255.255.250
Aug 24 14:36:34 Next-GenerationGatewayLite udm-iptvd[2888]: INFO[imp_verify_multicast_addr@262]: Group address 239.255.255.250 belongs to IPv4 Local Scope.
Aug 24 14:36:34 Next-GenerationGatewayLite udm-iptvd[2888]: DEBUG[main@653]: Data arrive
Aug 24 14:36:34 Next-GenerationGatewayLite udm-iptvd[2888]: DEBUG[mcast_recv_igmp@748]: src addr = 10.60.199.21
Aug 24 14:36:34 Next-GenerationGatewayLite udm-iptvd[2888]: received interface  25
Aug 24 14:36:34 Next-GenerationGatewayLite udm-iptvd[2888]: WARNING[mcast_recv_igmp@759]: Don't exist this Downstream VIF
Aug 24 14:36:34 Next-GenerationGatewayLite udm-iptvd[2888]: DEBUG[main@655]: timeoutAug 24 14:36:34 Next-GenerationGatewayLite udm-iptvd[2888]: DEBUG[general_queries_timer_handler@810]: Enter
Aug 24 14:36:34 Next-GenerationGatewayLite udm-iptvd[2888]: DEBUG[send_igmp_mld_query@101]: src = 172.16.210.1 dst = 224.0.0.1
Aug 24 14:36:34 Next-GenerationGatewayLite udm-iptvd[2888]: DEBUG[send_igmp_mld_query@104]: max_len = 1476
Aug 24 14:36:34 Next-GenerationGatewayLite udm-iptvd[2888]: DEBUG[send_igmp_mld_query@155]: igh_len  = 8
Aug 24 14:36:34 Next-GenerationGatewayLite udm-iptvd[2888]: DEBUG[main@653]: Data arrive
Aug 24 14:36:34 Next-GenerationGatewayLite udm-iptvd[2888]: DEBUG[mcast_recv_igmp@748]: src addr = 172.16.210.44
Aug 24 14:36:34 Next-GenerationGatewayLite udm-iptvd[2888]: received interface  19
Aug 24 14:36:34 Next-GenerationGatewayLite udm-iptvd[2888]: DEBUG[imp_input_report_v1v2@289]: group address 239.255.255.250
Aug 24 14:36:34 Next-GenerationGatewayLite udm-iptvd[2888]: INFO[imp_verify_multicast_addr@262]: Group address 239.255.255.250 belongs to IPv4 Local Scope.
Aug 24 14:36:34 Next-GenerationGatewayLite udm-iptvd[2888]: DEBUG[main@653]: Data arrive
Aug 24 14:36:34 Next-GenerationGatewayLite udm-iptvd[2888]: DEBUG[mcast_recv_igmp@748]: src addr = 172.16.210.180
Aug 24 14:36:34 Next-GenerationGatewayLite udm-iptvd[2888]: received interface  19
Aug 24 14:36:34 Next-GenerationGatewayLite udm-iptvd[2888]: DEBUG[imp_input_report_v1v2@289]: group address 239.255.255.250
Aug 24 14:36:34 Next-GenerationGatewayLite udm-iptvd[2888]: INFO[imp_verify_multicast_addr@262]: Group address 239.255.255.250 belongs to IPv4 Local Scope.
Aug 24 14:36:34 Next-GenerationGatewayLite udm-iptvd[2888]: DEBUG[main@653]: Data arrive
Aug 24 14:36:34 Next-GenerationGatewayLite udm-iptvd[2888]: DEBUG[mcast_recv_igmp@748]: src addr = 10.60.199.21
Aug 24 14:36:34 Next-GenerationGatewayLite udm-iptvd[2888]: received interface  25
Aug 24 14:36:34 Next-GenerationGatewayLite udm-iptvd[2888]: WARNING[mcast_recv_igmp@759]: Don't exist this Downstream VIF
Aug 24 14:36:34 Next-GenerationGatewayLite udm-iptvd[2888]: DEBUG[main@655]: timeoutAug 24 14:36:34 Next-GenerationGatewayLite udm-iptvd[2888]: DEBUG[general_queries_timer_handler@810]: Enter
Aug 24 14:36:34 Next-GenerationGatewayLite udm-iptvd[2888]: DEBUG[send_igmp_mld_query@101]: src = 172.16.210.1 dst = 224.0.0.1
Aug 24 14:36:34 Next-GenerationGatewayLite udm-iptvd[2888]: DEBUG[send_igmp_mld_query@104]: max_len = 1476
Aug 24 14:36:34 Next-GenerationGatewayLite udm-iptvd[2888]: DEBUG[send_igmp_mld_query@155]: igh_len  = 8
Aug 24 14:36:34 Next-GenerationGatewayLite udm-iptvd[2888]: DEBUG[main@653]: Data arrive
Aug 24 14:36:34 Next-GenerationGatewayLite udm-iptvd[2888]: DEBUG[mcast_recv_igmp@748]: src addr = 172.16.210.44
Aug 24 14:36:34 Next-GenerationGatewayLite udm-iptvd[2888]: received interface  19
Aug 24 14:36:34 Next-GenerationGatewayLite udm-iptvd[2888]: DEBUG[imp_input_report_v1v2@289]: group address 239.255.255.250
Aug 24 14:36:34 Next-GenerationGatewayLite udm-iptvd[2888]: INFO[imp_verify_multicast_addr@262]: Group address 239.255.255.250 belongs to IPv4 Local Scope.
Aug 24 14:36:34 Next-GenerationGatewayLite udm-iptvd[2888]: DEBUG[main@653]: Data arrive
Aug 24 14:36:34 Next-GenerationGatewayLite udm-iptvd[2888]: DEBUG[mcast_recv_igmp@748]: src addr = 10.60.199.21
Aug 24 14:36:34 Next-GenerationGatewayLite udm-iptvd[2888]: received interface  25
Aug 24 14:36:34 Next-GenerationGatewayLite udm-iptvd[2888]: WARNING[mcast_recv_igmp@759]: Don't exist this Downstream VIF
Aug 24 14:36:34 Next-GenerationGatewayLite udm-iptvd[2888]: DEBUG[main@653]: Data arrive
Aug 24 14:36:34 Next-GenerationGatewayLite udm-iptvd[2888]: DEBUG[mcast_recv_igmp@748]: src addr = 172.16.210.180
Aug 24 14:36:34 Next-GenerationGatewayLite udm-iptvd[2888]: received interface  19
Aug 24 14:36:34 Next-GenerationGatewayLite udm-iptvd[2888]: DEBUG[imp_input_report_v1v2@289]: group address 239.255.255.250
Aug 24 14:36:34 Next-GenerationGatewayLite udm-iptvd[2888]: INFO[imp_verify_multicast_addr@262]: Group address 239.255.255.250 belongs to IPv4 Local Scope.
Aug 24 14:36:34 Next-GenerationGatewayLite udm-iptvd[2888]: DEBUG[main@655]: timeout

**Comment by larscom** [comment]
Probably same issue as: https://github.com/fabianishere/udm-iptv/issues/410

**Comment by Theoreet** [comment]
> 1. Unifi UXG Lite -> us 16 poe 150w ->  usw lite 8 poe
> 2. 9.3.45 network Application, uxg lite 4.1.13, us16 7.1.26, usw lite 7.1.26
> 3. Different vlan for iptv where only the 2 boxes lives in.
> 4. KPN Netherlands , 2x kpn+ stb; 1 is directly connected through us16 and 1 is connected through usw lite
> 5. Next-GenerationGatewayLite:~# udm-iptv diagnose
>    Please share the following output with the developers:
>    === Configuration ===
>    WAN Interface: eth1
>    WAN VLAN: 4 (dev iptv)
>    WAN DHCP: true (options "-O staticroutes -V IPTV_RG")
>    WAN Ranges: 213.75.0.0/16  217.166.0.0/16  195.121.0.0/16
>    LAN Interfaces: br21
>    IGMP Proxy quickleave disabled: true
>    IGMP Proxy debug: true
>    === IP Link and Route ===
>    22: iptv@eth1: <BROADCAST,MULTICAST,UP,LOWER_UP> mtu 1500 qdisc noqueue state UP group default qlen 1000
>    inet 10.35.53.201/22 brd 10.35.55.255 scope global iptv
>    valid_lft forever preferred_lft forever
>    10.35.52.0/22 proto kernel scope link src 10.35.53.201
>    213.75.112.0/21 via 10.35.52.1 metric 222
>    === Service Logs ===
>    Aug 10 20:10:01 Next-GenerationGatewayLite udm-iptvd[2692]: WARNING[mcast_recv_igmp@759]: Don't exist this Downstream VIF
>    Aug 10 20:10:01 Next-GenerationGatewayLite udm-iptvd[2692]: DEBUG[main@655]: timeoutAug 10 20:10:01 Next-GenerationGatewayLite udm-iptvd[2692]: DEBUG[general_queries_timer_handler@810]: Enter
>    Aug 10 20:10:01 Next-GenerationGatewayLite udm-iptvd[2692]: DEBUG[send_igmp_mld_query@101]: src = 172.16.210.1 dst = 224.0.0.1
>    Aug 10 20:10:01 Next-GenerationGatewayLite udm-iptvd[2692]: DEBUG[send_igmp_mld_query@104]: max_len = 1476
>    Aug 10 20:10:01 Next-GenerationGatewayLite udm-iptvd[2692]: DEBUG[send_igmp_mld_query@155]: igh_len  = 8
>    Aug 10 20:10:01 Next-GenerationGatewayLite udm-iptvd[2692]: DEBUG[main@653]: Data arrive
>    Aug 10 20:10:01 Next-GenerationGatewayLite udm-iptvd[2692]: DEBUG[mcast_recv_igmp@748]: src addr = 172.16.210.180
>    Aug 10 20:10:01 Next-GenerationGatewayLite udm-iptvd[2692]: received interface  19
>    Aug 10 20:10:01 Next-GenerationGatewayLite udm-iptvd[2692]: DEBUG[imp_input_report_v1v2@289]: group address 239.255.255.250
> 6. Next-GenerationGatewayLite:~# cat /etc/udm-iptv.conf
> 
> ## Example configuration for udmp-iptv
> # Interface on which IPTV traffic enters the router
> IPTV_WAN_INTERFACE="eth1"
> 
> # ID of VLAN which carries IPTV traffic (use 0 if no VLAN is used)
> IPTV_WAN_VLAN="4"
> 
> # Name of the IPTV VLAN interface
> IPTV_WAN_VLAN_INTERFACE="iptv"
> 
> # IP ranges from which the IPTV traffic originates (separated by spaces)
> IPTV_WAN_RANGES="213.75.0.0/16 217.166.0.0/16 195.121.0.0/16"
> 
> # DHCP options to send when requesting an IP address
> IPTV_WAN_DHCP_OPTIONS="-O staticroutes -V IPTV_RG"
> 
> # LAN interfaces on which IPTV should be made available
> IPTV_LAN_INTERFACES="br21"
> 
> # Disable quickleave for igmpproxy
> IPTV_IGMPPROXY_DISABLE_QUICKLEAVE="true"
> 
> # Enable debugging for igmpproxy
> IPTV_IGMPPROXY_DEBUG="true" IPTV_IGMPPROXY_PROGRAM="improxy" IPTV_IGMPPROXY_IGMP_VERSION="2"

Network app 4.3.x is the problem. They changed something (if you did the reconfigure option from the Fabian script you'le see some extra rules (not only the VLAN option, but something like extra IP v4 rules) So they changed something within/after this version that broke the Fabian script solution. So somebody is maybe capable to reverse engineer this and changed the way this script is working now

**Comment by erikpost** [comment]
@Theoreet can you be more specific on what is different in the udm-iptv configuration wizard on Unifi OS 4.3.x? For example provide screenshots, or details on the "IPv4 rules" you mention.

**Comment by Theoreet** [comment]
Here you go 

<img width="984" height="490" alt="Image" src="https://github.com/user-attachments/assets/928b4725-8e3d-4716-89d3-c2603bb3189c" />
VLAN4 is normally the KPN TV LAN, and the 3 rules below are "the new ones"

**Comment by ROosterloo1988** [comment]
This is mine..

![Screenshot_20250905-204446.png](https://github.com/user-attachments/assets/d75b0ec7-8142-410d-b256-754068ca343c)

**Comment by erikpost** [comment]
@ROosterloo1988 and @Theoreet I don't think this difference is the cause of the issues.

Most UnifiFi (Cloud) Gateways use `brx` as virtual interface for VLANs. UXG devices used different virtual interfaces, `eth0.xxx`. With recent updates this has been changed to `brx`. The udm-iptv configuration wizard will check for both `eth0.xxx` and `brx` interfaces on UXG devices, which results in the LAN and VLAN entries in your screenshots.

As long as you pick the correct entry for your local IPTV VLAN (starting with `VLAN`) it should be ok.

**Comment by Theoreet** [comment]
> [@ROosterloo1988](https://github.com/ROosterloo1988) and [@Theoreet](https://github.com/Theoreet) I don't think this difference is the cause of the issues.
> 
> Most UnifiFi (Cloud) Gateways use `brx` as virtual interface for VLANs. UXG devices used different virtual interfaces, `eth0.xxx`. With recent updates this has been changed to `brx`. The udm-iptv configuration wizard will check for both `eth0.xxx` and `brx` interfaces on UXG devices, which results in the LAN and VLAN entries in your screenshots.
> 
> As long as you pick the correct entry for your local IPTV VLAN (starting with `VLAN`) it should be ok.

I was really hoping this was it, but there's more going on...but what.....that's the question

**Comment by Theoreet** [comment]
Here's the diagnose output: 

Please share the following output with the developers:
=== Configuration ===
WAN Interface: eth1
WAN VLAN: 4 (dev iptv)
WAN DHCP: true (options "-O staticroutes -V IPTV_RG")
WAN Ranges: 0.0.0.0/0
LAN Interfaces: br4
IGMP Proxy quickleave disabled: false
IGMP Proxy debug: false
=== IP Link and Route ===
33: iptv@eth1: <BROADCAST,MULTICAST,UP,LOWER_UP> mtu 1500 qdisc noqueue state UP group default qlen 1000
    inet 10.174.218.214/22 brd 10.174.219.255 scope global iptv
       valid_lft forever preferred_lft forever
10.174.216.0/22 proto kernel scope link src 10.174.218.214
213.75.112.0/21 via 10.174.216.1 metric 233
=== Service Logs ===
Sep 05 21:33:45 UXG-Lite udm-iptvd[3007]: udhcpc: started, v1.30.1
Sep 05 21:33:46 UXG-Lite udm-iptvd[3007]: udhcpc: sending discover
Sep 05 21:33:46 UXG-Lite udm-iptvd[3007]: udhcpc: sending select for 10.174.218.214
Sep 05 21:33:46 UXG-Lite udm-iptvd[3007]: udhcpc: lease of 10.174.218.214 obtained, lease time 3600
Sep 05 21:33:47 UXG-Lite udm-iptvd[2990]: NATing IPTV network ranges (if necessary)
Sep 05 21:33:47 UXG-Lite udm-iptvd[2990]: Creating static routes (if necessary)
Sep 05 21:33:47 UXG-Lite udm-iptvd[2990]: Setting up IGMP Proxy
Sep 05 21:33:47 UXG-Lite udm-iptvd[2990]: Using igmpproxy...
Sep 05 21:33:52 UXG-Lite udm-iptvd[2990]: Starting IGMP Proxy
Sep 05 21:41:01 UXG-Lite igmpproxy[2990]: MRT_DEL_MFC; Errno(2): No such file or directory

**Comment by erikpost** [comment]
What happens if you use improxy instead of igmpproxy? And what is the ID of the **local** VLAN where you have your STB? From the log it seems to be VLAN ID 4, but is that correct?

**Comment by ROosterloo1988** [comment]
Also with igmp v3 freezes the tv after 30 minutes.

**Comment by rhvs** [comment]
Probably same issue here... after a long chat with ChatGPT... it appears that once I start "tcpdump -ni br4 multicast" the tv works again, however, if I close terminal... after a while it stops. If I start the tcpdump -ni br4 multicast... it starts etc etc etc Hopefully someone recognises this because I'm out of ideas

**Comment by larscom** [comment]
Maybe this is related? https://www.totaaltv.nl/nieuws/kpn-verhelpt-problemen-multicast-op-tv-decoders/

**Comment by Dubbeldrank** [comment]
> Maybe this is related? https://www.totaaltv.nl/nieuws/kpn-verhelpt-problemen-multicast-op-tv-decoders/

I'm already on 1.99.3 firmware on the DIW7022, i guess that is the problem right now. Unicast works just fine, Multicast is the problem. So i don't think it's a Unifi problem but a KPN firmware problem. It started for me last night, before that it was all fine.

**Comment by Theoreet** [comment]
> What happens if you use improxy instead of igmpproxy? And what is the ID of the **local** VLAN where you have your STB? From the log it seems to be VLAN ID 4, but is that correct?

When i change to connect improxy the same thing is happening. My VLAN for KPN IP-TV is VLAN4 indeed

**Comment by rhvs** [comment]
sending coffee (-edit- and terminal output to get it working for as long as the dump is running which could be more useful then coffee) to @fabianishere ☕️ I hope it makes sense to someone.


`root@***:~# tcpdump -ni br4 multicast
tcpdump: verbose output suppressed, use -v[v]... for full protocol decode
listening on br4, link-type EN10MB (Ethernet), snapshot length 262144 bytes
10:30:25.692152 IP 195.121.94.212.34182 > 224.0.250.64.9875: UDP, length 397
10:30:26.875275 IP 195.121.94.212.34182 > 224.0.250.64.9875: UDP, length 310
10:30:27.037341 IP 195.121.94.212.34182 > 224.0.250.64.9875: UDP, length 614
10:30:28.652482 IP 195.121.94.212.34182 > 224.0.250.64.9875: UDP, length 394
10:30:29.522639 IP 195.121.94.212.34182 > 224.0.250.64.9875: UDP, length 452
10:30:30.194861 IP 195.121.94.212.34182 > 224.0.250.64.9875: UDP, length 394
10:30:30.304844 IP 195.121.94.212.34182 > 224.0.250.64.9875: UDP, length 452
10:30:31.093939 IP 195.121.94.212.34182 > 224.0.250.64.9875: UDP, length 310
10:30:31.540065 IP 195.121.94.212.34182 > 224.0.250.64.9875: UDP, length 614
10:30:32.512179 IP 195.121.94.212.34182 > 224.0.250.64.9875: UDP, length 315
10:30:33.087184 IP 195.121.94.212.34182 > 224.0.250.64.9875: UDP, length 446
10:30:33.238079 IP 10.10.0.1.46874 > 233.89.188.1.10001: UDP, length 4
10:30:33.238141 IP 10.10.0.1.46874 > 255.255.255.255.10001: UDP, length 4
10:30:33.471461 IP 195.121.94.212.34182 > 224.0.250.64.9875: UDP, length 394
10:30:33.548575 IP 195.121.94.212.34182 > 224.0.250.64.9875: UDP, length 452
10:30:33.767664 IP 195.121.94.212.34182 > 224.0.250.64.9875: UDP, length 310
10:30:33.781585 IP6 fe80::7a45:58ff:fedc:93a > ff02::1: HBH ICMP6, multicast listener querymax resp delay: 10000 addr: ::, length 24
10:30:33.785818 IP 195.121.94.212.34182 > 224.0.250.64.9875: UDP, length 614
10:30:34.579123 IP6 fe80::76ac:b9ff:fe13:dadb > ff02::1:ff00:0: HBH ICMP6, multicast listener reportmax resp delay: 0 addr: ff02::1:ff00:0, length 24
10:30:34.715951 IP 195.121.94.212.34182 > 224.0.250.64.9875: UDP, length 310
10:30:36.480087 IP 195.121.94.212.34182 > 224.0.250.64.9875: UDP, length 394
10:30:36.990101 IP 195.121.94.212.34182 > 224.0.250.64.9875: UDP, length 397
10:30:37.609126 IP6 fe80::76ac:b9ff:fe13:dadb > ff02::2: HBH ICMP6, multicast listener reportmax resp delay: 0 addr: ff02::2, length 24
10:30:38.822192 IP 195.121.94.212.34182 > 224.0.250.64.9875: UDP, length 614
10:30:39.042356 IP 195.121.94.212.34182 > 224.0.250.64.9875: UDP, length 452
10:30:40.350553 IP 195.121.94.212.34182 > 224.0.250.64.9875: UDP, length 394
10:30:40.551578 IP 195.121.94.212.34182 > 224.0.250.64.9875: UDP, length 310
10:30:40.764760 IP 195.121.94.212.34182 > 224.0.250.64.9875: UDP, length 394
10:30:40.823869 IP 195.121.94.212.34182 > 224.0.250.64.9875: UDP, length 452
10:30:41.451972 IP 195.121.94.212.34182 > 224.0.250.64.9875: UDP, length 315
10:30:41.549122 IP 195.121.94.212.34182 > 224.0.250.64.9875: UDP, length 446
10:30:42.044251 IP 195.121.94.212.34182 > 224.0.250.64.9875: UDP, length 310
10:30:42.892341 IP 195.121.94.212.34182 > 224.0.250.64.9875: UDP, length 614
10:30:43.498545 IP 195.121.94.212.34182 > 224.0.250.64.9875: UDP, length 310
10:30:43.609133 IP6 fe80::76ac:b9ff:fe13:dadb > ff02::1:ff13:dadb: HBH ICMP6, multicast listener reportmax resp delay: 0 addr: ff02::1:ff13:dadb, length 24
10:30:43.733013 IP 10.10.0.1.46874 > 233.89.188.1.10001: UDP, length 4
10:30:43.733080 IP 10.10.0.1.46874 > 255.255.255.255.10001: UDP, length 4
10:30:45.795652 IP 195.121.94.212.34182 > 224.0.250.64.9875: UDP, length 614
10:30:46.242426 IP 10.0.0.1 > 224.0.0.1: igmp query v2
10:30:46.839841 IP 195.121.94.212.34182 > 224.0.250.64.9875: UDP, length 452
10:30:47.465852 IP 195.121.94.212.34182 > 224.0.250.64.9875: UDP, length 452
10:30:48.015953 IP 195.121.94.212.34182 > 224.0.250.64.9875: UDP, length 394
10:30:48.752697 IP 10.10.0.212 > 224.0.250.64: igmp v2 report 224.0.250.64
10:30:48.893045 IP 195.121.94.212.34182 > 224.0.250.64.9875: UDP, length 315
10:30:49.107244 IP 195.121.94.212.34182 > 224.0.250.64.9875: UDP, length 614
10:30:49.322400 IP 195.121.94.212.34182 > 224.0.250.64.9875: UDP, length 397
10:30:49.446437 IP 195.121.94.212.34182 > 224.0.250.64.9875: UDP, length 310
10:30:49.670567 IP 195.121.94.212.34182 > 224.0.250.64.9875: UDP, length 394
10:30:50.488677 IP 195.121.94.212.34182 > 224.0.250.64.9875: UDP, length 446
10:30:50.979821 IP 195.121.94.212.34182 > 224.0.250.64.9875: UDP, length 614
10:30:51.310988 IP 195.121.94.212.34182 > 224.0.250.64.9875: UDP, length 394
10:30:51.425968 IP 195.121.94.212.34182 > 224.0.250.64.9875: UDP, length 310
10:30:51.487432 IP 10.10.0.1.2647 > 224.0.37.42.2647: UDP, length 10
10:30:52.142843 IP 10.10.0.212 > 224.0.252.127: igmp v2 report 224.0.252.127
10:30:52.273719 IP 217.166.226.127.49152 > 224.0.252.127.7254: BCM-LI-SHIM: direction unknown, pkt-type unknown, pkt-subtype unknown, li-id 2226744
10:30:52.274922 IP 217.166.226.127.49152 > 224.0.252.127.7254: BCM-LI-SHIM: direction unknown, pkt-type unknown, pkt-subtype unknown, li-id 2226745
10:30:52.276408 IP 217.166.226.127.49152 > 224.0.252.127.7254: BCM-LI-SHIM: direction unknown, pkt-type unknown, pkt-subtype unknown, li-id 2226746
10:30:52.277829 IP 217.166.226.127.49152 > 224.0.252.127.7254: BCM-LI-SHIM: direction unknown, pkt-type unknown, pkt-subtype unknown, li-id 2226747
10:30:52.279303 IP 217.166.226.127.49152 > 224.0.252.127.7254: BCM-LI-SHIM: direction unknown, pkt-type unknown, pkt-subtype unknown, li-id 2226748
10:30:52.280861 IP 217.166.226.127.49152 > 224.0.252.127.7254: BCM-LI-SHIM: direction unknown, pkt-type unknown, pkt-subtype unknown, li-id 2226749
10:30:52.282340 IP 217.166.226.127.49152 > 224.0.252.127.7254: BCM-LI-SHIM: direction unknown, pkt-type unknown, pkt-subtype unknown, li-id 2226750
10:30:52.283971 IP 217.166.226.127.49152 > 224.0.252.127.7254: BCM-LI-SHIM: direction unknown, pkt-type unknown, pkt-subtype unknown, li-id 2226751
10:30:52.285442 IP 217.166.226.127.49152 > 224.0.252.127.7254: BCM-LI-SHIM: direction unknown, pkt-type unknown, pkt-subtype unknown, li-id 2226752
10:30:52.286952 IP 217.166.226.127.49152 > 224.0.252.127.7254: BCM-LI-SHIM: direction unknown, pkt-type unknown, pkt-subtype unknown, li-id 2226753
10:30:52.288449 IP 217.166.226.127.49152 > 224.0.252.127.7254: BCM-LI-SHIM: direction unknown, pkt-type unknown, pkt-subtype unknown, li-id 2226754
`

**Comment by rhvs** [comment]
Minor update in case anyone is also stuck - after restoring the previous firmware of (all) the switches it works again.

**Comment by Dubbeldrank** [comment]
> Minor update in case anyone is also stuck - after restoring the previous firmware of (all) the switches it works again.

Same here, downgraded my switches to 7.1.26 and it works again.

**Comment by dbloom86** [comment]
I downgraded my switches as well. But with just downgrading my Flex mini, nothing changed. The thing that made it work again was downgrading my 16 POE Lite. (The latest firmware for that one is from 8 september 2025) So that might be the culprit.

**Comment by Dubbeldrank** [comment]
There are some IGMP changes in the latest Unifi Switch firmware update, so which one breaks the multicast throughput for the STBs. My STB even crashes with the new update after having a hanging stream.

**Comment by arjen-w** [comment]
There are indeed issues with switch firmware 7.2.x and KPN. I experienced the same issue with the same errors. You need to downgrade ALL switches to a 7.1 firmware version in order to get things working again. See also [https://community.ui.com/questions/IPTV-issue/3455fcad-3750-4fb7-8034-581fcd2c6f9c](https://community.ui.com/questions/IPTV-issue/3455fcad-3750-4fb7-8034-581fcd2c6f9c).
Once downgraded, it will start working again.

**Comment by Adz-ai** [comment]
Can confirm Downgrading Switch Firmware to 7.1.x also fixed it for BT/EE TV. Note that I didn't need to downgrade all my switches just the ones in the tree that my setup boxes are connected to.

**Comment by arjen-w** [comment]
> Can confirm Downgrading Switch Firmware to 7.1.x also fixed it for BT/EE TV. Note that I didn't need to downgrade all my switches just the ones in the tree that my setup boxes are connected to.

Can you please add that to teh topic on the ubiquiti forum as well? That would tell them that it is not only an issue for the Dutch KPN provider, but more providers are facing this, so they might prioritize the resolution.

**Comment by Dubbeldrank** [comment]
They pulled Switch firmware 7.2.120 from release to release candidate. So they might be looking into it.

**Comment by ROosterloo1988** [comment]
Same problem. New firmware of the decoder 1.99.3 and also the switch firmware 7.1.26.


> Maybe this is related? https://www.totaaltv.nl/nieuws/kpn-verhelpt-problemen-multicast-op-tv-decoders/

**Comment by Dubbeldrank** [comment]
> Same problem. New firmware of the decoder 1.99.3 and also the switch firmware 7.1.26.
> 
> > Maybe this is related? https://www.totaaltv.nl/nieuws/kpn-verhelpt-problemen-multicast-op-tv-decoders/

I'm running on that decoder fimware for a week or so, the problem is the switch firmware.

**Comment by Dubbeldrank** [comment]
Earlier today some i recieved a firmware from Ubiquiti to test, this fixes the problems with multicast IPTV. It has been released now as early access.

If you don't have access to the early access firmwares you can download it directly using this link:
https://dl.ui.com/unifi/firmware/USMULT/7.2.122.16564/US.MULT_7.2.122+16564.250924.1759.bin

**Comment by rhvs** [comment]
It's silent on this topic - does that mean I'm the only one where KPN is still reverting to unicast? I tried a lot (also 0.0.0.0/0) but even when multicast seems to stick (LIVE instead of Live) then after a few seconds it all freezes. A bit annoying so hopefully someone has a brilliant idea (or could point me to the topic on UI.com where I can shoutout to the UI team).

UDM Pro UnifiOS 4.4.3
Network 9.5.21
Switches on firmware 7.2.123



=== Configuration ===
WAN Interface: eth9
WAN VLAN: 4 (dev iptv)
WAN DHCP: true (options "-O staticroutes -V IPTV_RG")
WAN Ranges: 213.75.0.0/16  217.166.0.0/16  195.121.0.0/16
LAN Interfaces: br4
IGMP Proxy quickleave disabled: true
IGMP Proxy debug: false
=== IP Link and Route ===
54: iptv@eth9: <BROADCAST,MULTICAST,UP,LOWER_UP> mtu 1500 qdisc noqueue state UP group default qlen 1000
    inet 10.227.6.76/20 brd 10.227.15.255 scope global iptv
       valid_lft forever preferred_lft forever
10.227.0.0/20 proto kernel scope link src 10.227.6.76 
213.75.112.0/21 via 10.227.0.1 metric 254 
=== Service Logs ===
Oct 12 21:10:55 Delft udm-iptvd[296900]: udhcpc: sending discover
Oct 12 21:10:57 Delft udm-iptvd[296900]: udhcpc: sending discover
Oct 12 21:10:57 Delft udm-iptvd[296900]: udhcpc: sending select for 10.227.6.76
Oct 12 21:11:00 Delft udm-iptvd[296900]: udhcpc: sending select for 10.227.6.76
Oct 12 21:11:01 Delft udm-iptvd[296900]: udhcpc: lease of 10.227.6.76 obtained, lease time 3600
Oct 12 21:11:01 Delft udm-iptvd[296888]: NATing IPTV network ranges (if necessary)
Oct 12 21:11:01 Delft udm-iptvd[296888]: Creating static routes (if necessary)
Oct 12 21:11:01 Delft udm-iptvd[296888]: Setting up IGMP Proxy
Oct 12 21:11:01 Delft udm-iptvd[296888]: Using igmpproxy...
Oct 12 21:11:01 Delft udm-iptvd[296888]: Starting IGMP Proxy

**Comment by arjen-w** [comment]
> It's silent on this topic - does that mean I'm the only one where KPN is still reverting to unicast? I tried a lot (also 0.0.0.0/0) but even when multicast seems to stick (LIVE instead of Live) then after a few seconds it all freezes. A bit annoying so hopefully someone has a brilliant idea (or could point me to the topic on UI.com where I can shoutout to the UI team).
> 
> UDM Pro UnifiOS 4.4.3 Network 9.5.21 Switches on firmware 7.2.123
> 
> === Configuration === WAN Interface: eth9 WAN VLAN: 4 (dev iptv) WAN DHCP: true (options "-O staticroutes -V IPTV_RG") WAN Ranges: 213.75.0.0/16 217.166.0.0/16 195.121.0.0/16 LAN Interfaces: br4 IGMP Proxy quickleave disabled: true IGMP Proxy debug: false === IP Link and Route === 54: iptv@eth9: <BROADCAST,MULTICAST,UP,LOWER_UP> mtu 1500 qdisc noqueue state UP group default qlen 1000 inet 10.227.6.76/20 brd 10.227.15.255 scope global iptv valid_lft forever preferred_lft forever 10.227.0.0/20 proto kernel scope link src 10.227.6.76 213.75.112.0/21 via 10.227.0.1 metric 254 === Service Logs === Oct 12 21:10:55 Delft udm-iptvd[296900]: udhcpc: sending discover Oct 12 21:10:57 Delft udm-iptvd[296900]: udhcpc: sending discover Oct 12 21:10:57 Delft udm-iptvd[296900]: udhcpc: sending select for 10.227.6.76 Oct 12 21:11:00 Delft udm-iptvd[296900]: udhcpc: sending select for 10.227.6.76 Oct 12 21:11:01 Delft udm-iptvd[296900]: udhcpc: lease of 10.227.6.76 obtained, lease time 3600 Oct 12 21:11:01 Delft udm-iptvd[296888]: NATing IPTV network ranges (if necessary) Oct 12 21:11:01 Delft udm-iptvd[296888]: Creating static routes (if necessary) Oct 12 21:11:01 Delft udm-iptvd[296888]: Setting up IGMP Proxy Oct 12 21:11:01 Delft udm-iptvd[296888]: Using igmpproxy... Oct 12 21:11:01 Delft udm-iptvd[296888]: Starting IGMP Proxy

I think for the majority of us the issue started with the new firmware and has been "resolved" by reverting to an earlier version.

You are mentioning firmware version 7.2.123, this is an RC version which probably almost no-one is using here. 
Please report your issues to Ubiquiti in the .123 RC firmware topic here: https://community.ui.com/releases/UniFi-Switch-7-2-123/831d8520-c857-44bc-9e6e-2d8ad425e1b5.

**Comment by erikpost** [comment]
> It's silent on this topic - does that mean I'm the only one where KPN is still reverting to unicast? I tried a lot (also 0.0.0.0/0) but even when multicast seems to stick (LIVE instead of Live) then after a few seconds it all freezes. A bit annoying so hopefully someone has a brilliant idea (or could point me to the topic on UI.com where I can shoutout to the UI team).
> 
> UDM Pro UnifiOS 4.4.3 Network 9.5.21 Switches on firmware 7.2.123

For me KPN TV+ in multicast is running fine with a UDM Pro, USW-24-PoE and US8-60W. UnifiOS is on EA (4.4.3), Network Application is also EA (9.5.21) but switches are on GA (7.1.27).

**Comment by Dubbeldrank** [comment]
> > It's silent on this topic - does that mean I'm the only one where KPN is still reverting to unicast? I tried a lot (also 0.0.0.0/0) but even when multicast seems to stick (LIVE instead of Live) then after a few seconds it all freezes. A bit annoying so hopefully someone has a brilliant idea (or could point me to the topic on UI.com where I can shoutout to the UI team).
> > UDM Pro UnifiOS 4.4.3 Network 9.5.21 Switches on firmware 7.2.123
> > === Configuration === WAN Interface: eth9 WAN VLAN: 4 (dev iptv) WAN DHCP: true (options "-O staticroutes -V IPTV_RG") WAN Ranges: 213.75.0.0/16 217.166.0.0/16 195.121.0.0/16 LAN Interfaces: br4 IGMP Proxy quickleave disabled: true IGMP Proxy debug: false === IP Link and Route === 54: iptv@eth9: <BROADCAST,MULTICAST,UP,LOWER_UP> mtu 1500 qdisc noqueue state UP group default qlen 1000 inet 10.227.6.76/20 brd 10.227.15.255 scope global iptv valid_lft forever preferred_lft forever 10.227.0.0/20 proto kernel scope link src 10.227.6.76 213.75.112.0/21 via 10.227.0.1 metric 254 === Service Logs === Oct 12 21:10:55 Delft udm-iptvd[296900]: udhcpc: sending discover Oct 12 21:10:57 Delft udm-iptvd[296900]: udhcpc: sending discover Oct 12 21:10:57 Delft udm-iptvd[296900]: udhcpc: sending select for 10.227.6.76 Oct 12 21:11:00 Delft udm-iptvd[296900]: udhcpc: sending select for 10.227.6.76 Oct 12 21:11:01 Delft udm-iptvd[296900]: udhcpc: lease of 10.227.6.76 obtained, lease time 3600 Oct 12 21:11:01 Delft udm-iptvd[296888]: NATing IPTV network ranges (if necessary) Oct 12 21:11:01 Delft udm-iptvd[296888]: Creating static routes (if necessary) Oct 12 21:11:01 Delft udm-iptvd[296888]: Setting up IGMP Proxy Oct 12 21:11:01 Delft udm-iptvd[296888]: Using igmpproxy... Oct 12 21:11:01 Delft udm-iptvd[296888]: Starting IGMP Proxy
> 
> I think for the majority of us the issue started with the new firmware and has been "resolved" by reverting to an earlier version.
> 
> You are mentioning firmware version 7.2.123, this is an RC version which probably almost no-one is using here. Please report your issues to Ubiquiti in the .123 RC firmware topic here: https://community.ui.com/releases/UniFi-Switch-7-2-123/831d8520-c857-44bc-9e6e-2d8ad425e1b5.

The issue that came up in 7.2.120 was fixed in 7.2.122 which i linked here above and mentioned in the release notes of 7.2.123. As the problem is fixed it sounds like a configuration issue.

**Comment by Dubbeldrank** [comment]
Switch firmware 7.2.123 became stable just an hour ago.

**Comment by rhvs** [comment]
> > It's silent on this topic - does that mean I'm the only one where KPN is still reverting to unicast? I tried a lot (also 0.0.0.0/0) but even when multicast seems to stick (LIVE instead of Live) then after a few seconds it all freezes. A bit annoying so hopefully someone has a brilliant idea (or could point me to the topic on UI.com where I can shoutout to the UI team).
> > UDM Pro UnifiOS 4.4.3 Network 9.5.21 Switches on firmware 7.2.123
> 
> For me KPN TV+ in multicast is running fine with a UDM Pro, USW-24-PoE and US8-60W. UnifiOS is on EA (4.4.3), Network Application is also EA (9.5.21) but switches are on GA (7.1.27).

Super interesting as we have more or less the same setup and it's been working like a charm for years... I just nuked the UDMP and started from a backup to get a "fresh" install of the script, but it still reverts to unicast (so the vlan settings on the ports must be right) or when it stays in multicast it freezes after a few seconds. Could you confirm whether you have the same settings:

Network - IGMP Snooping - (selected the relevant vlan) IPTV
Network - IGMP Snooping - Forward Unknown Multicast Traffic - Drop
Network - IGMP Snooping - Flood known protocols - not selected
Network - IGMP Snooping - Fast leave - not selected
Network - IGMP Snooping - Querier Switch - (selected one if the switches in the network)

Thanks!

**Comment by erikpost** [comment]
> Super interesting as we have more or less the same setup and it's been working like a charm for years... I just nuked the UDMP and started from a backup to get a "fresh" install of the script, but it still reverts to unicast (so the vlan settings on the ports must be right) or when it stays in multicast it freezes after a few seconds. Could you confirm whether you have the same settings:
> 
> Network - IGMP Snooping - (selected the relevant vlan) IPTV

IGMP snooping is set to on for IPTV VLAN (and other relevant VLANs I have)

> Network - IGMP Snooping - Forward Unknown Multicast Traffic - Drop

Set to Drop for me as well.

> Network - IGMP Snooping - Flood known protocols - not selected

I have this enabled.

> Network - IGMP Snooping - Fast leave - not selected

I have Fast Leave set to On, but only because I have one KPN TV+ STB. If you have more than one leave this disabled.

> Network - IGMP Snooping - Querier Switch - (selected one if the switches in the network)

I have added the two switches in my network as Querier Switches for IPTV VLAN (and two other VLANs).

Also check how you have set your ports, I have set the Native VLAN on the switch port to which the STB is connected to IPTV VLAN, Tagged VLAN Management to Block All.

And make sure you have disabled IGMP Proxy setting in Settings > Internet > your primary internet connection.

**Comment by arjen-w** [comment]
Anyone with some luck on KPN and firmware version 7.2 .123? I upgraded my switch to this version today, but IPTV doesn't work. After reverting back to 7.1.26 TV just started working again.

**Comment by Dubbeldrank** [comment]
> Anyone with some luck on KPN and firmware version 7.2 .123? I upgraded my switch to this version today, but IPTV doesn't work. After reverting back to 7.1.26 TV just started working again.

KPN works just fine here with that firmware.

**Comment by arjen-w** [comment]
> > Anyone with some luck on KPN and firmware version 7.2 .123? I upgraded my switch to this version today, but IPTV doesn't work. After reverting back to 7.1.26 TV just started working again.
> 
> KPN works just fine here with that firmware.

I tried it again, after removing a carrier switch and multicast router port. It seems to work fine now..

**Comment by Dubbeldrank** [comment]
> > > Anyone with some luck on KPN and firmware version 7.2 .123? I upgraded my switch to this version today, but IPTV doesn't work. After reverting back to 7.1.26 TV just started working again.
> > 
> > 
> > KPN works just fine here with that firmware.
> 
> I tried it again, after removing a carrier switch and multicast router port. It seems to work fine now.

Good to hear i don't use those either.

**Comment by rhvs** [comment]
@fabianishere happy to share any log with you if that helps. I literally started from scratch with fresh install from the recovery partition of the UDM Pro, but that didn't solve it. Would be great if the years of successful use of the setup could be continued.[https://community.ui.com/questions/Multicast-issues/cc999a2d-0fea-48a9-93a0-f8d2b1e75427](url)

**Comment by arjen-w** [comment]
Try removing the carrier switches in your config. This was solving my issue at least.
Try the settings mentioned by others in this thread first, to see if that makes any difference. If it works for me and others, it sounds like a config issue. If it worked with the previous switch firmware versions, it has not something to do with the iptv-udm script.

**Comment by rhvs** [comment]
Tried all of that - even compared setup with erikpost.  If it doesn't work with cable directly connected to the UDM pro on a fresh install, I cannot see how I can exclude the possibility of the script not working for a fresh install on the latest firmware(s).

**Comment by arjen-w** [comment]
Try getting things setup with the previous version of the firmware on the switches first. (7.1.x).
The 7.2.x firmware introduced some new features (like the carrier switches) that can affect the complete network, even though the STB is connected to the UDM directly. This is activated when even a single switch has this firmware version, as I understood.

It seems like some documentation needs to be updated, rather than the script itself, as it is working for multiple setups.

**Comment by rhvs** [comment]
After installing the latest EA UnifiOS 5.0.4 and also the EA firmware for the U6 IW (6.7.35), it all works again!

**Comment by Theoreet** [comment]
`Here` some extra/ new output, it works for some minutes then.... stops .
Also when i change the channel it display's "LIVE" for a second, and after this second "Live" it is . So it seems to go back from uni to multicast.
On the output at 20:15 the stream stops working


```
-- Journal begins at Thu 2025-11-13 12:09:16 CET. --
Nov 13 20:18:41 GatewayLite udm-iptvd[2981]: received interface  20
Nov 13 20:18:41 GatewayLite udm-iptvd[2981]: DEBUG[imp_input_report_v1v2@289]: g                            roup address 239.255.255.250
Nov 13 20:18:41 GatewayLite udm-iptvd[2981]: INFO[imp_verify_multicast_addr@262]                            : Group address 239.255.255.250 belongs to IPv4 Local Scope.
Nov 13 20:18:41 GatewayLite udm-iptvd[2981]: DEBUG[main@653]: Data arrive
Nov 13 20:18:41 GatewayLite udm-iptvd[2981]: DEBUG[mcast_recv_igmp@748]: src add                            r = 192.168.4.10
Nov 13 20:18:41 GatewayLite udm-iptvd[2981]: received interface  20
Nov 13 20:18:41 GatewayLite udm-iptvd[2981]: DEBUG[imp_input_report_v1v2@289]: g                            roup address 224.0.252.136
Nov 13 20:18:41 GatewayLite udm-iptvd[2981]: DEBUG[main@653]: Data arrive
Nov 13 20:18:41 GatewayLite udm-iptvd[2981]: DEBUG[mcast_recv_igmp@748]: src add                            r = 198.18.1.120
Nov 13 20:18:41 GatewayLite udm-iptvd[2981]: received interface  21
Nov 13 20:21:12 GatewayLite udm-iptvd[2981]: WARNING[mcast_recv_igmp@753]: Don't exist this VIF 21
Nov 13 20:21:12 GatewayLite udm-iptvd[2981]: DEBUG[main@653]: Data arrive
Nov 13 20:21:12 GatewayLite udm-iptvd[2981]: DEBUG[mcast_recv_igmp@748]: src addr = 10.3.1.1
Nov 13 20:21:12 GatewayLite udm-iptvd[2981]: received interface  21
Nov 13 20:21:12 GatewayLite udm-iptvd[2981]: WARNING[mcast_recv_igmp@753]: Don't exist this VIF 21
Nov 13 20:21:12 GatewayLite udm-iptvd[2981]: DEBUG[main@653]: Data arrive
Nov 13 20:21:12 GatewayLite udm-iptvd[2981]: DEBUG[mcast_recv_igmp@748]: src addr = 198.18.1.120
Nov 13 20:21:12 GatewayLite udm-iptvd[2981]: received interface  21
Nov 13 20:21:12 GatewayLite udm-iptvd[2981]: WARNING[mcast_recv_igmp@753]: Don't exist this VIF 21
Nov 13 20:21:12 GatewayLite udm-iptvd[2981]: DEBUG[main@653]: Data arrive
Nov 13 20:21:12 GatewayLite udm-iptvd[2981]: DEBUG[mcast_recv_igmp@748]: src addr = 10.3.1.1
Nov 13 20:21:12 GatewayLite udm-iptvd[2981]: received interface  21
Nov 13 20:21:12 GatewayLite udm-iptvd[2981]: WARNING[mcast_recv_igmp@753]: Don't exist this VIF 21
Nov 13 20:21:12 GatewayLite udm-iptvd[2981]: DEBUG[main@653]: Data arrive
Nov 13 20:21:12 GatewayLite udm-iptvd[2981]: DEBUG[mcast_recv_igmp@748]: src addr = 192.168.1.121
Nov 13 20:21:12 GatewayLite udm-iptvd[2981]: received interface  20
Nov 13 20:21:12 GatewayLite udm-iptvd[2981]: WARNING[mcast_recv_igmp@804]: unknown igmp type 0x11
Nov 13 20:21:12 GatewayLite udm-iptvd[2981]: DEBUG[main@653]: Data arrive
Nov 13 20:21:12 GatewayLite udm-iptvd[2981]: DEBUG[mcast_recv_igmp@698]: Ignore igmp from myself
Nov 13 20:21:12 GatewayLite udm-iptvd[2981]: DEBUG[main@653]: Data arrive
Nov 13 20:21:12 GatewayLite udm-iptvd[2981]: DEBUG[mcast_recv_igmp@748]: src addr = 192.168.4.10
Nov 13 20:21:12 GatewayLite udm-iptvd[2981]: received interface  20
Nov 13 20:21:12 GatewayLite udm-iptvd[2981]: DEBUG[imp_input_report_v1v2@289]: group address 239.255.255.250
Nov 13 20:21:12 GatewayLite udm-iptvd[2981]: INFO[imp_verify_multicast_addr@262]: Group address 239.255.255.250 belongs to IPv4 Local Scope.
Nov 13 20:21:12 GatewayLite udm-iptvd[2981]: DEBUG[main@653]: Data arrive
Nov 13 20:21:12 GatewayLite udm-iptvd[2981]: DEBUG[mcast_recv_igmp@748]: src addr = 192.168.4.10
Nov 13 20:21:12 GatewayLite udm-iptvd[2981]: received interface  20
Nov 13 20:21:12 GatewayLite udm-iptvd[2981]: DEBUG[imp_input_report_v1v2@289]: group address 224.0.252.136
Nov 13 20:21:12 GatewayLite udm-iptvd[2981]: DEBUG[main@653]: Data arrive
Nov 13 20:21:12 GatewayLite udm-iptvd[2981]: DEBUG[mcast_recv_igmp@698]: Ignore igmp from myself
Nov 13 20:21:12 GatewayLite udm-iptvd[2981]: DEBUG[main@653]: Data arrive
Nov 13 20:21:12 GatewayLite udm-iptvd[2981]: DEBUG[mcast_recv_igmp@698]: Ignore igmp from myself
Nov 13 20:21:12 GatewayLite udm-iptvd[2981]: DEBUG[main@653]: Data arrive
Nov 13 20:21:12 GatewayLite udm-iptvd[2981]: DEBUG[mcast_recv_igmp@748]: src addr = 198.18.1.120
Nov 13 20:21:12 GatewayLite udm-iptvd[2981]: received interface  21
Nov 13 20:21:12 GatewayLite udm-iptvd[2981]: WARNING[mcast_recv_igmp@753]: Don't exist this VIF 21
Nov 13 20:21:12 GatewayLite udm-iptvd[2981]: DEBUG[main@653]: Data arrive
Nov 13 20:21:12 GatewayLite udm-iptvd[2981]: DEBUG[mcast_recv_igmp@748]: src addr = 10.3.1.1
Nov 13 20:21:12 GatewayLite udm-iptvd[2981]: received interface  21
Nov 13 20:21:12 GatewayLite udm-iptvd[2981]: WARNING[mcast_recv_igmp@753]: Don't exist this VIF 21
Nov 13 20:21:12 GatewayLite udm-iptvd[2981]: DEBUG[main@653]: Data arrive
Nov 13 20:21:12 GatewayLite udm-iptvd[2981]: DEBUG[mcast_recv_igmp@748]: src addr = 10.10.10.10
Nov 13 20:21:12 GatewayLite udm-iptvd[2981]: received interface  23
Nov 13 20:21:12 GatewayLite udm-iptvd[2981]: WARNING[mcast_recv_igmp@759]: Don't exist this Downstream VIF
Nov 13 20:21:12 GatewayLite udm-iptvd[2981]: DEBUG[main@653]: Data arrive
Nov 13 20:21:12 GatewayLite udm-iptvd[2981]: DEBUG[mcast_recv_igmp@748]: src addr = 198.18.1.120
Nov 13 20:21:12 GatewayLite udm-iptvd[2981]: received interface  21
Nov 13 20:21:12 GatewayLite udm-iptvd[2981]: WARNING[mcast_recv_igmp@753]: Don't exist this VIF 21
Nov 13 20:21:12 GatewayLite udm-iptvd[2981]: DEBUG[main@653]: Data arrive
Nov 13 20:21:12 GatewayLite udm-iptvd[2981]: DEBUG[mcast_recv_igmp@748]: src addr = 10.3.1.1
Nov 13 20:21:12 GatewayLite udm-iptvd[2981]: received interface  21
Nov 13 20:21:12 GatewayLite udm-iptvd[2981]: WARNING[mcast_recv_igmp@753]: Don't exist this VIF 21
Nov 13 20:21:12 GatewayLite udm-iptvd[2981]: DEBUG[main@653]: Data arrive
Nov 13 20:21:12 GatewayLite udm-iptvd[2981]: DEBUG[mcast_recv_igmp@748]: src addr = 192.168.1.121
Nov 13 20:21:12 GatewayLite udm-iptvd[2981]: received interface  18
Nov 13 20:21:12 GatewayLite udm-iptvd[2981]: WARNING[mcast_recv_igmp@753]: Don't exist this VIF 18
Nov 13 20:21:12 GatewayLite udm-iptvd[2981]: DEBUG[main@653]: Data arrive
Nov 13 20:21:12 GatewayLite udm-iptvd[2981]: DEBUG[mcast_recv_igmp@748]: src addr = 192.168.1.121
Nov 13 20:21:12 GatewayLite udm-iptvd[2981]: received interface  19
Nov 13 20:21:12 GatewayLite udm-iptvd[2981]: WARNING[mcast_recv_igmp@753]: Don't exist this VIF 19
Nov 13 20:21:12 GatewayLite udm-iptvd[2981]: DEBUG[main@653]: Data arrive
Nov 13 20:21:12 GatewayLite udm-iptvd[2981]: DEBUG[mcast_recv_igmp@748]: src addr = 192.168.6.1
Nov 13 20:21:12 GatewayLite udm-iptvd[2981]: received interface  19
Nov 13 20:21:12 GatewayLite udm-iptvd[2981]: WARNING[mcast_recv_igmp@753]: Don't exist this VIF 19
Nov 13 20:21:12 GatewayLite udm-iptvd[2981]: DEBUG[main@653]: Data arrive
Nov 13 20:21:12 GatewayLite udm-iptvd[2981]: DEBUG[mcast_recv_igmp@748]: src addr = 192.168.1.254
Nov 13 20:21:12 GatewayLite udm-iptvd[2981]: received interface  18
Nov 13 20:21:12 GatewayLite udm-iptvd[2981]: WARNING[mcast_recv_igmp@753]: Don't exist this VIF 18
Nov 13 20:21:12 GatewayLite udm-iptvd[2981]: DEBUG[main@653]: Data arrive
Nov 13 20:21:12 GatewayLite udm-iptvd[2981]: DEBUG[mcast_recv_igmp@748]: src addr = 192.168.1.254
Nov 13 20:21:12 GatewayLite udm-iptvd[2981]: received interface  18
Nov 13 20:21:12 GatewayLite udm-iptvd[2981]: WARNING[mcast_recv_igmp@753]: Don't exist this VIF 18
Nov 13 20:21:12 GatewayLite udm-iptvd[2981]: DEBUG[main@653]: Data arrive
Nov 13 20:21:12 GatewayLite udm-iptvd[2981]: DEBUG[mcast_recv_igmp@748]: src addr = 192.168.6.1
Nov 13 20:21:12 GatewayLite udm-iptvd[2981]: received interface  19
Nov 13 20:21:12 GatewayLite udm-iptvd[2981]: WARNING[mcast_recv_igmp@753]: Don't exist this VIF 19
Nov 13 20:21:12 GatewayLite udm-iptvd[2981]: DEBUG[main@655]: timeout
Nov 13 20:21:12 GatewayLite udm-iptvd[2981]: DEBUG[general_queries_timer_handler@810]: Enter
Nov 13 20:21:12 GatewayLite udm-iptvd[2981]: DEBUG[send_igmp_mld_query@101]: src = 192.168.4.1 dst = 224.0.0.1
Nov 13 20:21:12 GatewayLite udm-iptvd[2981]: DEBUG[send_igmp_mld_query@104]: max_len = 8976
Nov 13 20:21:12 GatewayLite udm-iptvd[2981]: DEBUG[send_igmp_mld_query@155]: igh_len  = 8
Nov 13 20:21:12 GatewayLite udm-iptvd[2981]: DEBUG[main@653]: Data arrive
Nov 13 20:21:12 GatewayLite udm-iptvd[2981]: DEBUG[mcast_recv_igmp@748]: src addr = 192.168.4.10
Nov 13 20:21:12 GatewayLite udm-iptvd[2981]: received interface  20
Nov 13 20:21:12 GatewayLite udm-iptvd[2981]: DEBUG[imp_input_report_v1v2@289]: group address 224.0.252.136
Nov 13 20:21:12 GatewayLite udm-iptvd[2981]: DEBUG[main@653]: Data arrive
Nov 13 20:21:12 GatewayLite udm-iptvd[2981]: DEBUG[mcast_recv_igmp@748]: src addr = 198.18.1.120
Nov 13 20:21:12 GatewayLite udm-iptvd[2981]: received interface  21
Nov 13 20:21:12 GatewayLite udm-iptvd[2981]: WARNING[mcast_recv_igmp@753]: Don't exist this VIF 21
Nov 13 20:21:12 GatewayLite udm-iptvd[2981]: DEBUG[main@653]: Data arrive
Nov 13 20:21:12 GatewayLite udm-iptvd[2981]: DEBUG[mcast_recv_igmp@748]: src addr = 10.3.1.1
Nov 13 20:21:12 GatewayLite udm-iptvd[2981]: received interface  21
Nov 13 20:21:12 GatewayLite udm-iptvd[2981]: WARNING[mcast_recv_igmp@753]: Don't exist this VIF 21
Nov 13 20:21:12 GatewayLite udm-iptvd[2981]: DEBUG[main@653]: Data arrive
Nov 13 20:21:12 GatewayLite udm-iptvd[2981]: DEBUG[mcast_recv_igmp@748]: src addr = 192.168.4.10
Nov 13 20:21:12 GatewayLite udm-iptvd[2981]: received interface  20
Nov 13 20:21:12 GatewayLite udm-iptvd[2981]: DEBUG[imp_input_report_v1v2@289]: group address 239.255.255.250
Nov 13 20:21:12 GatewayLite udm-iptvd[2981]: INFO[imp_verify_multicast_addr@262]: Group address 239.255.255.250 belongs to IPv4 Local Scope.
Nov 13 20:21:12 GatewayLite udm-iptvd[2981]: DEBUG[main@653]: Data arrive
Nov 13 20:23:58 GatewayLite udm-iptvd[2981]: DEBUG[mcast_recv_igmp@748]: src addr = 198.18.1.120
Nov 13 20:23:58 GatewayLite udm-iptvd[2981]: received interface  21
Nov 13 20:23:58 GatewayLite udm-iptvd[2981]: WARNING[mcast_recv_igmp@753]: Don't exist this VIF 21
Nov 13 20:23:58 GatewayLite udm-iptvd[2981]: DEBUG[main@653]: Data arrive
Nov 13 20:23:58 GatewayLite udm-iptvd[2981]: DEBUG[mcast_recv_igmp@748]: src addr = 10.3.1.1
Nov 13 20:23:58 GatewayLite udm-iptvd[2981]: received interface  21
Nov 13 20:23:58 GatewayLite udm-iptvd[2981]: WARNING[mcast_recv_igmp@753]: Don't exist this VIF 21
Nov 13 20:23:58 GatewayLite udm-iptvd[2981]: DEBUG[main@653]: Data arrive
Nov 13 20:23:58 GatewayLite udm-iptvd[2981]: DEBUG[mcast_recv_igmp@748]: src addr = 192.168.1.121
Nov 13 20:23:58 GatewayLite udm-iptvd[2981]: received interface  20
Nov 13 20:23:58 GatewayLite udm-iptvd[2981]: WARNING[mcast_recv_igmp@804]: unknown igmp type 0x11
Nov 13 20:23:58 GatewayLite udm-iptvd[2981]: DEBUG[main@653]: Data arrive
Nov 13 20:23:58 GatewayLite udm-iptvd[2981]: DEBUG[mcast_recv_igmp@698]: Ignore igmp from myself
Nov 13 20:23:58 GatewayLite udm-iptvd[2981]: DEBUG[main@653]: Data arrive
Nov 13 20:23:58 GatewayLite udm-iptvd[2981]: DEBUG[mcast_recv_igmp@698]: Ignore igmp from myself
Nov 13 20:23:58 GatewayLite udm-iptvd[2981]: DEBUG[main@653]: Data arrive
Nov 13 20:23:58 GatewayLite udm-iptvd[2981]: DEBUG[mcast_recv_igmp@698]: Ignore igmp from myself
Nov 13 20:23:58 GatewayLite udm-iptvd[2981]: DEBUG[main@653]: Data arrive
Nov 13 20:23:58 GatewayLite udm-iptvd[2981]: DEBUG[mcast_recv_igmp@748]: src addr = 198.18.1.120
Nov 13 20:23:58 GatewayLite udm-iptvd[2981]: received interface  21
Nov 13 20:23:58 GatewayLite udm-iptvd[2981]: WARNING[mcast_recv_igmp@753]: Don't exist this VIF 21
Nov 13 20:23:58 GatewayLite udm-iptvd[2981]: DEBUG[main@653]: Data arrive
Nov 13 20:23:58 GatewayLite udm-iptvd[2981]: DEBUG[mcast_recv_igmp@748]: src addr = 10.3.1.1
Nov 13 20:23:58 GatewayLite udm-iptvd[2981]: received interface  21
Nov 13 20:23:58 GatewayLite udm-iptvd[2981]: WARNING[mcast_recv_igmp@753]: Don't exist this VIF 21
Nov 13 20:23:58 GatewayLite udm-iptvd[2981]: DEBUG[main@653]: Data arrive
Nov 13 20:23:58 GatewayLite udm-iptvd[2981]: DEBUG[mcast_recv_igmp@748]: src addr = 10.10.10.10
Nov 13 20:23:58 GatewayLite udm-iptvd[2981]: received interface  23
Nov 13 20:23:58 GatewayLite udm-iptvd[2981]: WARNING[mcast_recv_igmp@759]: Don't exist this Downstream VIF
Nov 13 20:23:58 GatewayLite udm-iptvd[2981]: DEBUG[main@653]: Data arrive
Nov 13 20:23:58 GatewayLite udm-iptvd[2981]: DEBUG[mcast_recv_igmp@748]: src addr = 198.18.1.120
Nov 13 20:23:58 GatewayLite udm-iptvd[2981]: received interface  21
Nov 13 20:23:58 GatewayLite udm-iptvd[2981]: WARNING[mcast_recv_igmp@753]: Don't exist this VIF 21
Nov 13 20:23:58 GatewayLite udm-iptvd[2981]: DEBUG[main@653]: Data arrive
Nov 13 20:23:58 GatewayLite udm-iptvd[2981]: DEBUG[mcast_recv_igmp@748]: src addr = 10.3.1.1
Nov 13 20:23:58 GatewayLite udm-iptvd[2981]: received interface  21
Nov 13 20:23:58 GatewayLite udm-iptvd[2981]: WARNING[mcast_recv_igmp@753]: Don't exist this VIF 21
Nov 13 20:23:58 GatewayLite udm-iptvd[2981]: DEBUG[main@653]: Data arrive
Nov 13 20:23:58 GatewayLite udm-iptvd[2981]: DEBUG[mcast_recv_igmp@748]: src addr = 192.168.1.121
Nov 13 20:23:58 GatewayLite udm-iptvd[2981]: received interface  18
Nov 13 20:23:58 GatewayLite udm-iptvd[2981]: WARNING[mcast_recv_igmp@753]: Don't exist this VIF 18
Nov 13 20:23:58 GatewayLite udm-iptvd[2981]: DEBUG[main@653]: Data arrive
Nov 13 20:23:58 GatewayLite udm-iptvd[2981]: DEBUG[mcast_recv_igmp@748]: src addr = 192.168.1.121
Nov 13 20:23:58 GatewayLite udm-iptvd[2981]: received interface  19
Nov 13 20:23:58 GatewayLite udm-iptvd[2981]: WARNING[mcast_recv_igmp@753]: Don't exist this VIF 19
Nov 13 20:23:58 GatewayLite udm-iptvd[2981]: DEBUG[main@653]: Data arrive
Nov 13 20:23:58 GatewayLite udm-iptvd[2981]: DEBUG[mcast_recv_igmp@748]: src addr = 192.168.1.254
Nov 13 20:23:58 GatewayLite udm-iptvd[2981]: received interface  18
Nov 13 20:23:58 GatewayLite udm-iptvd[2981]: WARNING[mcast_recv_igmp@753]: Don't exist this VIF 18
Nov 13 20:23:58 GatewayLite udm-iptvd[2981]: DEBUG[main@653]: Data arrive
Nov 13 20:23:58 GatewayLite udm-iptvd[2981]: DEBUG[mcast_recv_igmp@748]: src addr = 192.168.1.254
Nov 13 20:23:58 GatewayLite udm-iptvd[2981]: received interface  18
Nov 13 20:23:58 GatewayLite udm-iptvd[2981]: WARNING[mcast_recv_igmp@753]: Don't exist this VIF 18
Nov 13 20:23:58 GatewayLite udm-iptvd[2981]: DEBUG[main@653]: Data arrive
Nov 13 20:23:58 GatewayLite udm-iptvd[2981]: DEBUG[mcast_recv_igmp@748]: src addr = 192.168.6.1
Nov 13 20:23:58 GatewayLite udm-iptvd[2981]: received interface  19
Nov 13 20:23:58 GatewayLite udm-iptvd[2981]: WARNING[mcast_recv_igmp@753]: Don't exist this VIF 19
Nov 13 20:23:58 GatewayLite udm-iptvd[2981]: DEBUG[main@653]: Data arrive
Nov 13 20:23:58 GatewayLite udm-iptvd[2981]: DEBUG[mcast_recv_igmp@748]: src addr = 192.168.6.1
Nov 13 20:23:58 GatewayLite udm-iptvd[2981]: received interface  19
Nov 13 20:23:58 GatewayLite udm-iptvd[2981]: WARNING[mcast_recv_igmp@753]: Don't exist this VIF 19
Nov 13 20:23:58 GatewayLite udm-iptvd[2981]: DEBUG[main@653]: Data arrive
Nov 13 20:23:58 GatewayLite udm-iptvd[2981]: DEBUG[mcast_recv_igmp@748]: src addr = 198.18.1.120
Nov 13 20:23:58 GatewayLite udm-iptvd[2981]: received interface  21
Nov 13 20:23:58 GatewayLite udm-iptvd[2981]: WARNING[mcast_recv_igmp@753]: Don't exist this VIF 21
Nov 13 20:23:58 GatewayLite udm-iptvd[2981]: DEBUG[main@655]: timeout
Nov 13 20:23:58 GatewayLite udm-iptvd[2981]: DEBUG[general_queries_timer_handler@810]: Enter
Nov 13 20:23:58 GatewayLite udm-iptvd[2981]: DEBUG[send_igmp_mld_query@101]: src = 192.168.4.1 dst = 224.0.0.1
Nov 13 20:23:58 GatewayLite udm-iptvd[2981]: DEBUG[send_igmp_mld_query@104]: max_len = 8976
Nov 13 20:23:58 GatewayLite udm-iptvd[2981]: DEBUG[send_igmp_mld_query@155]: igh_len  = 8
Nov 13 20:23:58 GatewayLite udm-iptvd[2981]: DEBUG[main@653]: Data arrive
Nov 13 20:23:58 GatewayLite udm-iptvd[2981]: DEBUG[mcast_recv_igmp@748]: src addr = 10.3.1.1
Nov 13 20:23:58 GatewayLite udm-iptvd[2981]: received interface  21
Nov 13 20:23:58 GatewayLite udm-iptvd[2981]: WARNING[mcast_recv_igmp@753]: Don't exist this VIF 21
Nov 13 20:23:58 GatewayLite udm-iptvd[2981]: DEBUG[main@653]: Data arrive
Nov 13 20:23:58 GatewayLite udm-iptvd[2981]: DEBUG[mcast_recv_igmp@748]: src addr = 198.18.1.120
Nov 13 20:23:58 GatewayLite udm-iptvd[2981]: received interface  21
Nov 13 20:23:58 GatewayLite udm-iptvd[2981]: WARNING[mcast_recv_igmp@753]: Don't exist this VIF 21
Nov 13 20:23:58 GatewayLite udm-iptvd[2981]: DEBUG[main@653]: Data arrive
Nov 13 20:23:58 GatewayLite udm-iptvd[2981]: DEBUG[mcast_recv_igmp@748]: src addr = 10.3.1.1
Nov 13 20:23:58 GatewayLite udm-iptvd[2981]: received interface  21
Nov 13 20:23:58 GatewayLite udm-iptvd[2981]: WARNING[mcast_recv_igmp@753]: Don't exist this VIF 21
Nov 13 20:23:58 GatewayLite udm-iptvd[2981]: DEBUG[main@653]: Data arrive
Nov 13 20:23:58 GatewayLite udm-iptvd[2981]: DEBUG[mcast_recv_igmp@748]: src addr = 192.168.1.121
Nov 13 20:23:58 GatewayLite udm-iptvd[2981]: received interface  20
Nov 13 20:23:58 GatewayLite udm-iptvd[2981]: WARNING[mcast_recv_igmp@804]: unknown igmp type 0x11
Nov 13 20:23:58 GatewayLite udm-iptvd[2981]: DEBUG[main@653]: Data arrive
Nov 13 20:23:58 GatewayLite udm-iptvd[2981]: DEBUG[mcast_recv_igmp@698]: Ignore igmp from myself
Nov 13 20:23:58 GatewayLite udm-iptvd[2981]: DEBUG[main@653]: Data arrive
Nov 13 20:23:58 GatewayLite udm-iptvd[2981]: DEBUG[mcast_recv_igmp@698]: Ignore igmp from myself
Nov 13 20:23:58 GatewayLite udm-iptvd[2981]: DEBUG[main@653]: Data arrive
Nov 13 20:23:58 GatewayLite udm-iptvd[2981]: DEBUG[mcast_recv_igmp@698]: Ignore igmp from myself
Nov 13 20:23:58 GatewayLite udm-iptvd[2981]: DEBUG[main@653]: Data arrive
Nov 13 20:23:58 GatewayLite udm-iptvd[2981]: DEBUG[mcast_recv_igmp@748]: src addr = 198.18.1.120
Nov 13 20:23:58 GatewayLite udm-iptvd[2981]: received interface  21
Nov 13 20:23:58 GatewayLite udm-iptvd[2981]: WARNING[mcast_recv_igmp@753]: Don't exist this VIF 21
Nov 13 20:23:58 GatewayLite udm-iptvd[2981]: DEBUG[main@653]: Data arrive
Nov 13 20:23:58 GatewayLite udm-iptvd[2981]: DEBUG[mcast_recv_igmp@748]: src addr = 10.3.1.1
Nov 13 20:23:58 GatewayLite udm-iptvd[2981]: received interface  21
Nov 13 20:23:58 GatewayLite udm-iptvd[2981]: WARNING[mcast_recv_igmp@753]: Don't exist this VIF 21
Nov 13 20:23:58 GatewayLite udm-iptvd[2981]: DEBUG[main@653]: Data arrive
Nov 13 20:23:58 GatewayLite udm-iptvd[2981]: DEBUG[mcast_recv_igmp@748]: src addr = 192.168.1.121
Nov 13 20:23:58 GatewayLite udm-iptvd[2981]: received interface  18
Nov 13 20:25:15 GatewayLite udm-iptvd[2981]: WARNING[mcast_recv_igmp@753]: Don't exist this VIF 18
Nov 13 20:25:15 GatewayLite udm-iptvd[2981]: DEBUG[main@653]: Data arrive
Nov 13 20:25:15 GatewayLite udm-iptvd[2981]: DEBUG[mcast_recv_igmp@748]: src addr = 10.10.10.10
Nov 13 20:25:15 GatewayLite udm-iptvd[2981]: received interface  23
Nov 13 20:25:15 GatewayLite udm-iptvd[2981]: WARNING[mcast_recv_igmp@759]: Don't exist this Downstream VIF
Nov 13 20:25:15 GatewayLite udm-iptvd[2981]: DEBUG[main@653]: Data arrive
Nov 13 20:25:15 GatewayLite udm-iptvd[2981]: DEBUG[mcast_recv_igmp@748]: src addr = 192.168.1.121
Nov 13 20:25:15 GatewayLite udm-iptvd[2981]: received interface  18
Nov 13 20:25:15 GatewayLite udm-iptvd[2981]: WARNING[mcast_recv_igmp@753]: Don't exist this VIF 18
Nov 13 20:25:15 GatewayLite udm-iptvd[2981]: DEBUG[main@653]: Data arrive
Nov 13 20:25:15 GatewayLite udm-iptvd[2981]: DEBUG[mcast_recv_igmp@748]: src addr = 192.168.1.254
Nov 13 20:25:15 GatewayLite udm-iptvd[2981]: received interface  18
Nov 13 20:25:15 GatewayLite udm-iptvd[2981]: WARNING[mcast_recv_igmp@753]: Don't exist this VIF 18
Nov 13 20:25:15 GatewayLite udm-iptvd[2981]: DEBUG[main@653]: Data arrive
Nov 13 20:25:15 GatewayLite udm-iptvd[2981]: DEBUG[mcast_recv_igmp@748]: src addr = 198.18.1.120
Nov 13 20:25:15 GatewayLite udm-iptvd[2981]: received interface  21
Nov 13 20:25:15 GatewayLite udm-iptvd[2981]: WARNING[mcast_recv_igmp@753]: Don't exist this VIF 21
Nov 13 20:25:15 GatewayLite udm-iptvd[2981]: DEBUG[main@653]: Data arrive
Nov 13 20:25:15 GatewayLite udm-iptvd[2981]: DEBUG[mcast_recv_igmp@748]: src addr = 10.3.1.1
Nov 13 20:25:15 GatewayLite udm-iptvd[2981]: received interface  21
Nov 13 20:25:15 GatewayLite udm-iptvd[2981]: WARNING[mcast_recv_igmp@753]: Don't exist this VIF 21
Nov 13 20:25:15 GatewayLite udm-iptvd[2981]: DEBUG[main@653]: Data arrive
Nov 13 20:25:15 GatewayLite udm-iptvd[2981]: DEBUG[mcast_recv_igmp@748]: src addr = 192.168.1.121
Nov 13 20:25:15 GatewayLite udm-iptvd[2981]: received interface  18
Nov 13 20:25:15 GatewayLite udm-iptvd[2981]: WARNING[mcast_recv_igmp@753]: Don't exist this VIF 18
Nov 13 20:25:15 GatewayLite udm-iptvd[2981]: DEBUG[main@653]: Data arrive
Nov 13 20:25:15 GatewayLite udm-iptvd[2981]: DEBUG[mcast_recv_igmp@748]: src addr = 192.168.1.254
Nov 13 20:25:15 GatewayLite udm-iptvd[2981]: received interface  18
Nov 13 20:25:15 GatewayLite udm-iptvd[2981]: WARNING[mcast_recv_igmp@753]: Don't exist this VIF 18
Nov 13 20:25:15 GatewayLite udm-iptvd[2981]: DEBUG[main@653]: Data arrive
Nov 13 20:25:15 GatewayLite udm-iptvd[2981]: DEBUG[mcast_recv_igmp@748]: src addr = 192.168.1.121
Nov 13 20:25:15 GatewayLite udm-iptvd[2981]: received interface  18
Nov 13 20:25:15 GatewayLite udm-iptvd[2981]: WARNING[mcast_recv_igmp@753]: Don't exist this VIF 18
Nov 13 20:25:15 GatewayLite udm-iptvd[2981]: DEBUG[main@653]: Data arrive
Nov 13 20:25:15 GatewayLite udm-iptvd[2981]: DEBUG[mcast_recv_igmp@748]: src addr = 192.168.1.121
Nov 13 20:25:15 GatewayLite udm-iptvd[2981]: received interface  19
Nov 13 20:25:15 GatewayLite udm-iptvd[2981]: WARNING[mcast_recv_igmp@753]: Don't exist this VIF 19
Nov 13 20:25:15 GatewayLite udm-iptvd[2981]: DEBUG[main@653]: Data arrive
Nov 13 20:25:15 GatewayLite udm-iptvd[2981]: DEBUG[mcast_recv_igmp@748]: src addr = 192.168.6.1
Nov 13 20:25:15 GatewayLite udm-iptvd[2981]: received interface  19
Nov 13 20:25:15 GatewayLite udm-iptvd[2981]: WARNING[mcast_recv_igmp@753]: Don't exist this VIF 19
Nov 13 20:25:15 GatewayLite udm-iptvd[2981]: DEBUG[main@653]: Data arrive
Nov 13 20:25:15 GatewayLite udm-iptvd[2981]: DEBUG[mcast_recv_igmp@748]: src addr = 192.168.1.254
Nov 13 20:25:15 GatewayLite udm-iptvd[2981]: received interface  18
Nov 13 20:25:15 GatewayLite udm-iptvd[2981]: WARNING[mcast_recv_igmp@753]: Don't exist this VIF 18
Nov 13 20:25:15 GatewayLite udm-iptvd[2981]: DEBUG[main@653]: Data arrive
Nov 13 20:25:15 GatewayLite udm-iptvd[2981]: DEBUG[mcast_recv_igmp@748]: src addr = 192.168.6.1
Nov 13 20:25:15 GatewayLite udm-iptvd[2981]: received interface  19
Nov 13 20:25:15 GatewayLite udm-iptvd[2981]: WARNING[mcast_recv_igmp@753]: Don't exist this VIF 19
Nov 13 20:25:15 GatewayLite udm-iptvd[2981]: DEBUG[main@653]: Data arrive
Nov 13 20:25:15 GatewayLite udm-iptvd[2981]: DEBUG[mcast_recv_igmp@748]: src addr = 192.168.1.254
Nov 13 20:25:15 GatewayLite udm-iptvd[2981]: received interface  18
Nov 13 20:25:15 GatewayLite udm-iptvd[2981]: WARNING[mcast_recv_igmp@753]: Don't exist this VIF 18
Nov 13 20:25:15 GatewayLite udm-iptvd[2981]: DEBUG[main@653]: Data arrive
Nov 13 20:25:15 GatewayLite udm-iptvd[2981]: DEBUG[mcast_recv_igmp@748]: src addr = 198.18.1.120
Nov 13 20:25:15 GatewayLite udm-iptvd[2981]: received interface  21
Nov 13 20:25:15 GatewayLite udm-iptvd[2981]: WARNING[mcast_recv_igmp@753]: Don't exist this VIF 21
Nov 13 20:25:15 GatewayLite udm-iptvd[2981]: DEBUG[main@653]: Data arrive
Nov 13 20:25:15 GatewayLite udm-iptvd[2981]: DEBUG[mcast_recv_igmp@748]: src addr = 10.3.1.1
Nov 13 20:25:15 GatewayLite udm-iptvd[2981]: received interface  21
Nov 13 20:25:15 GatewayLite udm-iptvd[2981]: WARNING[mcast_recv_igmp@753]: Don't exist this VIF 21
Nov 13 20:25:15 GatewayLite udm-iptvd[2981]: DEBUG[main@655]: timeout
Nov 13 20:25:15 GatewayLite udm-iptvd[2981]: DEBUG[main@655]: timeout
Nov 13 20:25:15 GatewayLite udm-iptvd[2981]: DEBUG[main@655]: timeout
Nov 13 20:25:15 GatewayLite udm-iptvd[2981]: DEBUG[main@655]: timeout
Nov 13 20:25:15 GatewayLite udm-iptvd[2981]: DEBUG[main@655]: timeout
Nov 13 20:25:15 GatewayLite udm-iptvd[2981]: DEBUG[main@655]: timeout
Nov 13 20:25:15 GatewayLite udm-iptvd[2981]: DEBUG[main@655]: timeout
Nov 13 20:25:15 GatewayLite udm-iptvd[2981]: DEBUG[main@655]: timeout
Nov 13 20:25:15 GatewayLite udm-iptvd[2981]: DEBUG[main@655]: timeout
Nov 13 20:25:15 GatewayLite udm-iptvd[2981]: DEBUG[main@655]: timeout
Nov 13 20:25:15 GatewayLite udm-iptvd[2981]: DEBUG[main@655]: timeout
Nov 13 20:25:15 GatewayLite udm-iptvd[2981]: DEBUG[main@655]: timeout
Nov 13 20:25:15 GatewayLite udm-iptvd[2981]: DEBUG[main@655]: timeout
Nov 13 20:25:15 GatewayLite udm-iptvd[2981]: DEBUG[main@655]: timeout
Nov 13 20:25:15 GatewayLite udm-iptvd[2981]: DEBUG[main@655]: timeout
Nov 13 20:25:15 GatewayLite udm-iptvd[2981]: DEBUG[main@655]: timeout
Nov 13 20:25:15 GatewayLite udm-iptvd[2981]: DEBUG[main@655]: timeout
Nov 13 20:25:15 GatewayLite udm-iptvd[2981]: DEBUG[main@655]: timeout
Nov 13 20:25:15 GatewayLite udm-iptvd[2981]: DEBUG[main@655]: timeout
Nov 13 20:25:15 GatewayLite udm-iptvd[2981]: DEBUG[main@655]: timeout
Nov 13 20:25:15 GatewayLite udm-iptvd[2981]: DEBUG[general_queries_timer_handler@810]: Enter
Nov 13 20:25:15 GatewayLite udm-iptvd[2981]: DEBUG[send_igmp_mld_query@101]: src = 192.168.4.1 dst = 224.0.0.1
Nov 13 20:25:15 GatewayLite udm-iptvd[2981]: DEBUG[send_igmp_mld_query@104]: max_len = 8976
Nov 13 20:25:15 GatewayLite udm-iptvd[2981]: DEBUG[send_igmp_mld_query@155]: igh_len  = 8
Nov 13 20:25:15 GatewayLite udm-iptvd[2981]: DEBUG[main@655]: timeout
Nov 13 20:25:15 GatewayLite udm-iptvd[2981]: DEBUG[group_v2_timer_handler@521]: group 224.0.252.136 IGMPv2 version timer expired
Nov 13 20:25:15 GatewayLite udm-iptvd[2981]: DEBUG[imp_check_timer@171]: continue............
Nov 13 20:25:15 GatewayLite udm-iptvd[2981]: DEBUG[group_timer_handler@461]: cleanup group 224.0.252.136
Nov 13 20:25:15 GatewayLite udm-iptvd[2981]: DEBUG[imp_membership_db_update@354]: interface br4 don't have 224.0.252.136
Nov 13 20:25:15 GatewayLite udm-iptvd[2981]: DEBUG[imp_membership_db_mfc_update@269]: if_index 1 217.166.226.136 1
Nov 13 20:25:15 GatewayLite udm-iptvd[2981]: DEBUG[k_del_mfc@366]: clean mfc 217.166.226.136 224.0.252.136
Nov 13 20:25:15 GatewayLite udm-iptvd[2981]: DEBUG[imp_membership_db_update@354]: interface iptv don't have 224.0.252.136
Nov 13 20:25:15 GatewayLite udm-iptvd[2981]: DEBUG[imp_check_timer@171]: continue............
Nov 13 20:25:15 GatewayLite udm-iptvd[2981]: DEBUG[main@653]: Data arrive
Nov 13 20:25:15 GatewayLite udm-iptvd[2981]: DEBUG[mcast_recv_igmp@717]: k_get_rlif = 23 im_vif = 2
Nov 13 20:25:15 GatewayLite udm-iptvd[2981]: DEBUG[imp_get_mfcc_ttls@168]: group 224.0.252.136 isn't interest in packet from 217.166.226.136
Nov 13 20:25:15 GatewayLite udm-iptvd[2981]: DEBUG[main@653]: Data arrive
Nov 13 20:25:15 GatewayLite udm-iptvd[2981]: DEBUG[mcast_recv_igmp@748]: src addr = 198.18.1.120
Nov 13 20:25:15 GatewayLite udm-iptvd[2981]: received interface  21
Nov 13 20:25:15 GatewayLite udm-iptvd[2981]: WARNING[mcast_recv_igmp@753]: Don't exist this VIF 21
Nov 13 20:25:15 GatewayLite udm-iptvd[2981]: DEBUG[main@653]: Data arrive
Nov 13 20:25:15 GatewayLite udm-iptvd[2981]: DEBUG[mcast_recv_igmp@748]: src addr = 10.3.1.1
```


Running 5.0.4 on the UCK G2, 4.3.3 on the UXG lite, 2.1.8 on the USW Ultra switch behind the TV and 7.2.123 on the US 16 PoE

**Comment by NotStyles** [comment]
> After installing the latest EA UnifiOS 5.0.4 and also the EA firmware for the U6 IW (6.7.35), it all works again!

Can confirm on my side that 5.0.4 UnifiOS seems to not be freezing video on multicast after a couple seconds anymore. I've been running 4.2.12 for the longest time because 4.3.x up until 4.4.3 caused freezing. I have not tried 4.4.5 - 4.4.7 so it could've been fixed in those earlier releases.

UCG-Fiber
No switch
1 KPN TV+ box


# udm-iptv diag

Please share the following output with the developers:
=== Configuration ===
WAN Interface: eth6
WAN VLAN: 4 (dev iptv)
WAN DHCP: true (options "-O staticroutes -V IPTV_RG")
WAN Ranges: 213.75.0.0/16  217.166.0.0/16  195.121.0.0/16
LAN Interfaces: br30
IGMP Proxy quickleave disabled: false
IGMP Proxy debug: false
=== IP Link and Route ===
39: iptv@eth6: <BROADCAST,MULTICAST,UP,LOWER_UP> mtu 1500 qdisc noqueue state UP group default qlen 1000
    inet 10.198.68.237/20 brd 10.198.79.255 scope global iptv
       valid_lft forever preferred_lft forever
10.198.64.0/20 proto kernel scope link src 10.198.68.237
213.75.112.0/21 via 10.198.64.1 metric 239

**Comment by TPuschl** [comment]
Dear Community,
maybe some one can help. I use A1xploreTV and on my new UXG-MAX with firmware 4.1.13 and Unifi Network 9.5.21 and IPTV only works when the br0 interface (which is the LAN-port) is in promicous mode on the UXG via the tcpdump command e.g. "tcpdump igmp -i br0".
As soon as i exist the tcdump via SSH on the UXG-MAX the videostream stops.
I had first installed the latest version 4.3.1 on the UXG but it didnt work as well so i downgraded to 4.1.13.

The udm-iptv diagnose is:

root@UXGMax:/var/log/ulog# udm-iptv diagnose
Please share the following output with the developers:
=== Configuration ===
WAN Interface: eth4
WAN VLAN: 0 (dev eth4)
WAN DHCP: true (options "-O staticroutes -V IPTV_RG")
WAN Ranges: 224.0.0.0/4 87.141.0.0/16 193.158.0.0/15 0.0.0.0/0
LAN Interfaces: br0
IGMP Proxy quickleave disabled: false
IGMP Proxy debug: true
=== IP Link and Route ===
4: eth4: <BROADCAST,MULTICAST,UP,LOWER_UP> mtu 1500 qdisc mq state UP group default qlen 1000
    inet 10.0.0.1/24 scope global eth4
       valid_lft forever preferred_lft forever
10.0.0.0/24 proto kernel scope link src 10.0.0.1
=== Service Logs ===
Jan 10 21:00:32 UXGMax udm-iptvd[27603]: The IGMP message was from myself. Ignoring.
Jan 10 21:00:32 UXGMax udm-iptvd[27603]: RECV V2 member report   from 192.168.1.111   to 239.254.127.63
Jan 10 21:00:32 UXGMax udm-iptvd[27603]: Updated route entry for 239.254.127.63 on VIF #1
Jan 10 21:00:32 UXGMax udm-iptvd[27603]: The IGMP message was local multicast. Ignoring.
Jan 10 21:00:33 UXGMax udm-iptvd[27603]: RECV V2 member report   from 192.168.1.120   to 239.3.57.101
Jan 10 21:00:33 UXGMax udm-iptvd[27603]: Updated route entry for 239.3.57.101 on VIF #1
Jan 10 21:00:33 UXGMax udm-iptvd[27603]: Adding MFC: 213.33.32.33 -> 239.3.57.101, InpVIf: 0
Jan 10 21:00:33 UXGMax udm-iptvd[27603]: The IGMP message was local multicast. Ignoring.
Jan 10 21:00:34 UXGMax udm-iptvd[27603]: RECV V2 member report   from 192.168.1.254   to 224.0.0.251
Jan 10 21:00:34 UXGMax udm-iptvd[27603]: The IGMP message was from myself. Ignoring.

I already tried it also with the native built in igmp-proxy of unify but it is exactly the same behaviour.
I also tried it with disabled IGMP-Snopping and with enabled, but the behaviour is exactly the same.

Everything was working fine with my old USG3 where i enabled IGMP-Proxy via the config-gateway.json file with the below config whcih is not available anymore on UXG-Max

"protocols": {
    "igmp-proxy": {
      "interface": {
        "eth0": {
          "alt-subnet": "0.0.0.0/0",
          "role": "upstream",
          "threshold": "1"
        },
        "eth1": {
          "alt-subnet": "192.168.1.0/24",
          "role": "downstream",
          "threshold": "1"
        }
      }
    }
  },

Does anybody have an idea how to solve the issue?
Many Thanks
