### ISSUE TITLE
Not working on a ucg fiber

### ISSUE THREAD

**Issue by deomyrnl** [fabianishere/udm-iptv#439]
I try to run it on a ucg fiber with multiple different tries but it did not work. my provider is trined

**Comment by deomyrnl** [comment]
at the moment of writing i have **UniFi is 5.0.16, Network 10.2.105**

**Comment by erikpost** [comment]
Can you post more info on your UniFi setup? More specifically what VLAN you use locally and if you connect the TV box directly to your UCG Fiber or via a switch.

Based on reports from other trined users, you can use the KPN config as the basis but change the following settings in `/etc/udm-iptv.conf:
- `IPTV_WAN_RANGES="0.0.0.0/0"`
- `IPTV_WAN_DHCP_OPTIONS="o -O subnet -O broadcast -O staticroutes"`
- `IPTV_WAN_INTERFACE="eth6"` if you use an SFP Fiber module or `IPTV_WAN_INTERFACE="eth4"` if you use the Ethernet WAN port
- `IPTV_LAN_INTERFACES="br<id of your local IPTV VLAN>"` (e.g. `br6` if your local IPTV VLAN has ID 6)
- `IPTV_WAN_VLAN_INTERFACE`, `IPTV_IGMPPROXY_DISABLE_QUICKLEAVE` and `IPTV_IGMPPROXY_DEBUG` can be left at default values

Also make sure you have enabled IGMP snooping for your local IPTV network in UniFi Network Application. Make sure the setting "IGMP Proxy" is *disabled* on your internet connection in Network Application. And assign your local IPTV network as the "Native VLAN / Network" for the port where your TV box is connected and set "Tagged VLAN Management" to "Block All".

**Comment by deomyrnl** [comment]
Hello @erikpost ,

At the vlan40 network i enabled the snooping and the igmp proxy is disabled at the wan port.
after the installation in rebooted the UCG-Fiber to clear some stuff up.

I have the following setup:

Huawei PON (Fiber to UTP / COAX)
|
UCG-Fiber with UniFi is 5.0.16, Network 10.2.105 - - - 2x USW Flex 2.5g 5-port
|
USW Flex 2.5G 8 port switch
| 
TV Box connected to port 8. (with native vlan40 (Called TriNed-TV)) and Tagged VLAN Management to Block All

```
From there i used the following configuration
## Example configuration for udmp-iptv ##
# Interface on which IPTV traffic enters the router
IPTV_WAN_INTERFACE="eth4"
# ID of VLAN which carries IPTV traffic (use 0 if no VLAN is used)
IPTV_WAN_VLAN="4"
# Name of the IPTV VLAN interface
IPTV_WAN_VLAN_INTERFACE="iptv"
# IP ranges from which the IPTV traffic originates (separated by spaces)
IPTV_WAN_RANGES="0.0.0.0/0"
# DHCP options to send when requesting an IP address
IPTV_WAN_DHCP_OPTIONS="-o -O subnet -O broadcast -O staticroutes"
# LAN interfaces on which IPTV should be made available
IPTV_LAN_INTERFACES="br40"
# Disable quickleave for igmpproxy
IPTV_IGMPPROXY_DISABLE_QUICKLEAVE="false"
# Enable debugging for igmpproxy
IPTV_IGMPPROXY_DEBUG="true"
IPTV_IGMPPROXY_PROGRAM="improxy" (and i used the "igmpproxy")
IPTV_IGMPPROXY_IGMP_VERSION="2"
```

**Comment by erikpost** [comment]
Config looks ok to me. What issues are you having?

And what does the improxy log say, any errors in there? And output of `udm-iptv diagnose` would be useful as well. And please put the logs in code blocks so it stays readable here.

**Comment by deomyrnl** [comment]
The main issue i got is that the tv box is screaming "im still watching" but the message is not passed well trough so trined is pushing a leave message and the video is stopping. i will make some logs on friday. then i will share them here.

**Comment by erikpost** [comment]
Ok, some things you could try in the meantime is to disable quickleave (set `IPTV_IGMPPROXY_DISABLE_QUICKLEAVE` to `true` in udm-iptv.conf, and restart the udm-iptv service). Or play around with the IGMP snooping settings in Network Application, Ubiquity expanded these settings in the last couple of releases.

**Comment by dmutsaers** [comment]
My biggest hurdle with a stable udm-iptv setup ended up being the IGMP Snooping settings on the USW-Lite-16-PoE switch. improxy is the IGMP Querier. You can only have one (active) IGMP Querier in a network.

<img width="1099" height="736" alt="Image" src="https://github.com/user-attachments/assets/8106277a-2616-4bb4-b4de-8a469a1b1e2a" />

**Comment by deomyrnl** [comment]
<img width="861" height="381" alt="Image" src="https://github.com/user-attachments/assets/c89361e9-edb7-41c4-830c-4664f375acab" />

@dmutsaers  Tomorrow i will try those settings, the red marked once i cannot change. (maybe after the fabric reset i can)

**Comment by deomyrnl** [comment]
````
root@Cloud-Gateway-Fiber:~# ip -s mroute
(10.50.9.83,239.3.4.17)          Iif: iptv       Oifs: br40  State: resolved
  247507 packets, 332649408 bytes, Age 0.00
(10.61.131.94,233.89.188.1)      Iif: unresolved  State: unresolved
(192.168.40.1,233.89.188.1)      Iif: unresolved  State: unresolved
root@Cloud-Gateway-Fiber:~# udm-iptv diagnose
Please share the following output with the developers:
=== Configuration ===
WAN Interface: eth4
WAN VLAN: 4 (dev iptv)
WAN DHCP: true (options "-o -O subnet -O broadcast -O staticroutes -V IPTV_RG")
WAN Ranges: 0.0.0.0/0
LAN Interfaces: br40
IGMP Proxy quickleave disabled: false
IGMP Proxy debug: true
=== IP Link and Route ===
31: iptv@eth4: <BROADCAST,MULTICAST,UP,LOWER_UP> mtu 1500 qdisc noqueue state UP group default qlen 1000
    inet 10.61.131.94/10 scope global iptv
       valid_lft forever preferred_lft forever
10.0.0.0/10 proto kernel scope link src 10.61.131.94
=== Service Logs ===
Apr 10 08:03:38 Cloud-Gateway-Fiber udm-iptvd[100719]: DEBUG[main@653]: Data arrive
Apr 10 08:03:38 Cloud-Gateway-Fiber udm-iptvd[100719]: DEBUG[mcast_recv_igmp@748]: src addr = 192.168.40.94
Apr 10 08:03:38 Cloud-Gateway-Fiber udm-iptvd[100719]: received interface  24
Apr 10 08:03:38 Cloud-Gateway-Fiber udm-iptvd[100719]: DEBUG[imp_input_report_v1v2@289]: group address 225.0.71.1
Apr 10 08:03:38 Cloud-Gateway-Fiber udm-iptvd[100719]: DEBUG[main@653]: Data arrive
Apr 10 08:03:38 Cloud-Gateway-Fiber udm-iptvd[100719]: DEBUG[mcast_recv_igmp@698]: Ignore igmp from myself
Apr 10 08:03:38 Cloud-Gateway-Fiber udm-iptvd[100719]: DEBUG[main@653]: Data arrive
Apr 10 08:03:38 Cloud-Gateway-Fiber udm-iptvd[100719]: DEBUG[mcast_recv_igmp@698]: Ignore igmp from myself
Apr 10 08:03:38 Cloud-Gateway-Fiber udm-iptvd[100719]: DEBUG[main@653]: Data arrive
Apr 10 08:03:38 Cloud-Gateway-Fiber udm-iptvd[100719]: DEBUG[mcast_recv_igmp@698]: Ignore igmp from myself
root@Cloud-Gateway-Fiber:~#
````

at 08:04 the signal stopped working, i tried with igmp snooping off on the network but then it directly stops working

after updating the network unit 
````
root@Cloud-Gateway-Fiber:~# udm-iptv diagnose
Please share the following output with the developers:
=== Configuration ===
WAN Interface: eth4
WAN VLAN: 4 (dev iptv)
WAN DHCP: true (options "-o -O subnet -O broadcast -O staticroutes -V IPTV_RG")
WAN Ranges: 0.0.0.0/0
LAN Interfaces: br40
IGMP Proxy quickleave disabled: true
IGMP Proxy debug: true
=== IP Link and Route ===
31: iptv@eth4: <BROADCAST,MULTICAST,UP,LOWER_UP> mtu 1500 qdisc noqueue state UP group default qlen 1000
    inet 10.61.131.94/10 scope global iptv
       valid_lft forever preferred_lft forever
10.0.0.0/10 proto kernel scope link src 10.61.131.94
=== Service Logs ===
Apr 10 08:24:28 Cloud-Gateway-Fiber udm-iptvd[132024]: DEBUG[main@655]: timeout
Apr 10 08:24:28 Cloud-Gateway-Fiber udm-iptvd[132024]: DEBUG[main@655]: timeout
Apr 10 08:24:28 Cloud-Gateway-Fiber udm-iptvd[132024]: DEBUG[main@655]: timeout
Apr 10 08:24:28 Cloud-Gateway-Fiber udm-iptvd[132024]: DEBUG[main@655]: timeout
Apr 10 08:24:28 Cloud-Gateway-Fiber udm-iptvd[132024]: DEBUG[main@655]: timeout
Apr 10 08:24:28 Cloud-Gateway-Fiber udm-iptvd[132024]: DEBUG[main@655]: timeout
Apr 10 08:24:28 Cloud-Gateway-Fiber udm-iptvd[132024]: DEBUG[main@655]: timeout
Apr 10 08:24:28 Cloud-Gateway-Fiber udm-iptvd[132024]: DEBUG[main@655]: timeout
Apr 10 08:24:28 Cloud-Gateway-Fiber udm-iptvd[132024]: DEBUG[main@655]: timeout
Apr 10 08:24:28 Cloud-Gateway-Fiber udm-iptvd[132024]: DEBUG[main@655]: timeout
````

**Comment by erikpost** [comment]
> My biggest hurdle with a stable udm-iptv setup ended up being the IGMP Snooping settings on the USW-Lite-16-PoE switch. improxy is the IGMP Querier. You can only have one (active) IGMP Querier in a network.

Are you sure that's true? IGMP Querier is not the same as a IGMP Proxy. A querier maintains multicast group memberships within a network while the IGMP Proxy does the routing of queries and membership requests to an upstream network. So they serve different purposes.

For me IPTV works perfectly fine with heaving Querier Selection turned on in UniFi Network Application, with my main USW 24 PoE switch being the primary querier.

**Comment by erikpost** [comment]
> at 08:04 the signal stopped working, i tried with igmp snooping off on the network but then it directly stops working

Does IPTV work correctly if you connect the STB directly to your UCG Fiber? If I'm not mistaken the USW Flex doesn't support IGMP snooping so that might be causing issues. This also probably explains why you cannot change the Querier Selection setting, because you don't have any switches that support IGMP snooping.

**Comment by deomyrnl** [comment]
@erikpost it is greyed out and i cannot change / select it

<img width="648" height="397" alt="Image" src="https://github.com/user-attachments/assets/0e7e2031-7578-4d14-86c4-39be9883b6de" />

i connected the box to the ucg-fiber directly and rebooted the ucg and the box and again the 5 min issue.

**Comment by erikpost** [comment]
> [@erikpost](https://github.com/erikpost) it is greyed out and i cannot change / select it

Yeah, check my previous post, the USW Flex switches do not support IGMP Snooping so you have no switches that can act as IGMP Querier.

> i connected the box to the ucg-fiber directly and rebooted the ucg and the box and again the 5 min issue.

So this sounds like a timeout issue where membership reports are not handled correctly. Can be either an issue with IGMP Snooping or with the IGMP Proxy.

What's also worth trying is to use igmpproxy instead of the default improxy:
install it with `apt install igmpproxy` and then modify `/etc/udm-iptv.conf` to set `IPTV_IGMPPROXY_PROGRAM` to `igmpproxy`. Then restart the `udm-iptv` service with `systemctl restart udm-iptv`.

And I'd also try disconnecting the USW Flex switches and then trying with the STB directly connected to the UCG Fiber.

**Comment by deomyrnl** [comment]
after changing to igmpproxy i got the same issue, maybe i need to wait for a update of ubiquiti. 

`
root@Cloud-Gateway-Fiber:~# systemctl status udm-iptv
● udm-iptv.service - IPTV support for the UniFi Dream Machine
     Loaded: loaded (/usr/lib/systemd/system/udm-iptv.service; enabled; vendor preset: enabled)
     Active: active (running) since Fri 2026-04-10 09:46:49 CEST; 4min 42s ago
   Main PID: 11423 (igmpproxy)
      Tasks: 2 (limit: 3461)
     Memory: 1.8M
        CPU: 136ms
     CGroup: /system.slice/udm-iptv.service
             ├─11423 igmpproxy -n -d -v /var/run/igmpproxy.iptv.conf
             └─11623 busybox udhcpc -b -R -p /var/run/udhcpc.iptv.pid -s /usr/lib/udm-iptv/udhcpc.hook -i iptv -o -O subnet -O broadcast -O staticroutes -V IPTV_RG

Apr 10 09:51:17 Cloud-Gateway-Fiber udm-iptvd[11423]: can't leave group 233.89.188.1 on interface iptv; Errno(99): Cannot assign requested address
Apr 10 09:51:19 Cloud-Gateway-Fiber udm-iptvd[11423]: RECV V2 member report   from 192.168.40.1    to 233.89.188.1
Apr 10 09:51:19 Cloud-Gateway-Fiber udm-iptvd[11423]: The IGMP message was from myself. Ignoring.
Apr 10 09:51:24 Cloud-Gateway-Fiber udm-iptvd[11423]: RECV Leave message      from 192.168.40.1    to 224.0.0.2
Apr 10 09:51:24 Cloud-Gateway-Fiber udm-iptvd[11423]: RECV V2 member report   from 192.168.40.1    to 233.89.188.1
Apr 10 09:51:24 Cloud-Gateway-Fiber udm-iptvd[11423]: The IGMP message was from myself. Ignoring.
Apr 10 09:51:24 Cloud-Gateway-Fiber udm-iptvd[11423]: Inserted route table entry for 233.89.188.1 on VIF #-1
Apr 10 09:51:28 Cloud-Gateway-Fiber udm-iptvd[11423]: RECV V2 member report   from 192.168.40.1    to 233.89.188.1
Apr 10 09:51:28 Cloud-Gateway-Fiber udm-iptvd[11423]: The IGMP message was from myself. Ignoring.
Apr 10 09:51:31 Cloud-Gateway-Fiber udm-iptvd[11423]: RECV Membership query   from 192.168.40.1    to 224.0.0.1
`
`
root@Cloud-Gateway-Fiber:~# udm-iptv diagnose
Please share the following output with the developers:
=== Configuration ===
WAN Interface: eth4
WAN VLAN: 4 (dev iptv)
WAN DHCP: true (options "-o -O subnet -O broadcast -O staticroutes -V IPTV_RG")
WAN Ranges: 0.0.0.0/0
LAN Interfaces: br40
IGMP Proxy quickleave disabled: true
IGMP Proxy debug: true
=== IP Link and Route ===
30: iptv@eth4: <BROADCAST,MULTICAST,UP,LOWER_UP> mtu 1500 qdisc noqueue state UP group default qlen 1000
    inet 10.61.131.94/10 scope global iptv
       valid_lft forever preferred_lft forever
default via 10.0.0.1 metric 230
10.0.0.0/10 proto kernel scope link src 10.61.131.94
=== Service Logs ===
Apr 10 09:51:37 Cloud-Gateway-Fiber udm-iptvd[11423]: Updated route entry for 239.3.4.17 on VIF #0
Apr 10 09:51:37 Cloud-Gateway-Fiber udm-iptvd[11423]: Adding MFC: 10.50.9.83 -> 239.3.4.17, InpVIf: 1
Apr 10 09:51:38 Cloud-Gateway-Fiber udm-iptvd[11423]: RECV V2 member report   from 192.168.40.1    to 233.89.188.1
Apr 10 09:51:38 Cloud-Gateway-Fiber udm-iptvd[11423]: The IGMP message was from myself. Ignoring.
Apr 10 09:51:39 Cloud-Gateway-Fiber udm-iptvd[11423]: RECV V2 member report   from 192.168.40.1    to 224.0.37.42
Apr 10 09:51:39 Cloud-Gateway-Fiber udm-iptvd[11423]: The IGMP message was from myself. Ignoring.
Apr 10 09:51:39 Cloud-Gateway-Fiber udm-iptvd[11423]: Inserted route table entry for 224.0.37.42 on VIF #-1
Apr 10 09:51:40 Cloud-Gateway-Fiber udm-iptvd[11423]: RECV V2 member report   from 192.168.40.1    to 224.0.0.2
Apr 10 09:51:40 Cloud-Gateway-Fiber udm-iptvd[11423]: The IGMP message was from myself. Ignoring.
Apr 10 09:51:45 Cloud-Gateway-Fiber udm-iptvd[11423]: RECV Leave message      from 192.168.40.1    to 224.0.0.2
root@Cloud-Gateway-Fiber:~#

`

After the leave message the screen went stuck again

**Comment by dmutsaers** [comment]
> > My biggest hurdle with a stable udm-iptv setup ended up being the IGMP Snooping settings on the USW-Lite-16-PoE switch. improxy is the IGMP Querier. You can only have one (active) IGMP Querier in a network.
> 
> Are you sure that's true? IGMP Querier is not the same as a IGMP Proxy. A querier maintains multicast group memberships within a network while the IGMP Proxy does the routing of queries and membership requests to an upstream network. So they serve different purposes.
> 
> For me IPTV works perfectly fine with heaving Querier Selection turned on in UniFi Network Application, with my main USW 24 PoE switch being the primary querier.

Based on what I’ve observed in my own network:

With udm‑iptv using igmpproxy, a UniFi switch can be configured as an IGMP Querier without issues, IPTV works correctly.
The problem only occurs when using improxy.

When improxy is in use:

Enabling IGMP Querier on any UniFi switch causes IPTV multicast streams to behave erratically
Disabling IGMP Querier on all UniFi switches restores IPTV
Switching from improxy to igmpproxy resolves the issue entirely

This suggests the issue is specific to improxy combined with UniFi’s IGMP Querier, not to udm‑iptv in general and not present with igmpproxy.
Although IGMP Querier and IGMP Proxy are distinct roles by design, improxy appears to emit downstream IGMP queries in practice. IPTV continuing to work when UniFi IGMP Querier is disabled suggests improxy can maintain group membership on its own. When both improxy and a UniFi switch act as query sources, this likely results in conflicting queries and unstable multicast behavior.

That said, IGMP Querier and Snooping behavior has been inconsistent across recent firmware updates.

UCG Max 5.1.7, Network 10.2.105, USW Lite 16 PoE 7.4.1

**Comment by erikpost** [comment]
> > > My biggest hurdle with a stable udm-iptv setup ended up being the IGMP Snooping settings on the USW-Lite-16-PoE switch. improxy is the IGMP Querier. You can only have one (active) IGMP Querier in a network.
> > 
> > 
> > Are you sure that's true? IGMP Querier is not the same as a IGMP Proxy. A querier maintains multicast group memberships within a network while the IGMP Proxy does the routing of queries and membership requests to an upstream network. So they serve different purposes.
> > For me IPTV works perfectly fine with heaving Querier Selection turned on in UniFi Network Application, with my main USW 24 PoE switch being the primary querier.
> 
> Based on what I’ve observed in my own network:
> 
> With udm‑iptv using igmpproxy, a UniFi switch can be configured as an IGMP Querier without issues, IPTV works correctly. The problem only occurs when using improxy.
> 
> When improxy is in use:
> 
> Enabling IGMP Querier on any UniFi switch causes IPTV multicast streams to behave erratically Disabling IGMP Querier on all UniFi switches restores IPTV Switching from improxy to igmpproxy resolves the issue entirely
> 
> This suggests the issue is specific to improxy combined with UniFi’s IGMP Querier, not to udm‑iptv in general and not present with igmpproxy. Although IGMP Querier and IGMP Proxy are distinct roles by design, improxy appears to emit downstream IGMP queries in practice. IPTV continuing to work when UniFi IGMP Querier is disabled suggests improxy can maintain group membership on its own. When both improxy and a UniFi switch act as query sources, this likely results in conflicting queries and unstable multicast behavior.

Ah yes that makes sense. I was having issues (stuttering, hanging streams) with improxy as well since a recent update of Network Application (not sure what version), and switching to igmpproxy resolved the issues. Didn't try changing the IGMP Snooping settings.

**Comment by deomyrnl** [comment]
I will try it the following way this should work right? or doe i need to change the fast leave option:

````
## Example configuration for udmp-iptv ##
# Interface on which IPTV traffic enters the router
IPTV_WAN_INTERFACE="eth4"
# ID of VLAN which carries IPTV traffic (use 0 if no VLAN is used)
IPTV_WAN_VLAN="4"
# Name of the IPTV VLAN interface
IPTV_WAN_VLAN_INTERFACE="iptv"
# IP ranges from which the IPTV traffic originates (separated by spaces)
IPTV_WAN_RANGES="0.0.0.0/0"
# DHCP options to send when requesting an IP address
IPTV_WAN_DHCP_OPTIONS="-o -O subnet -O broadcast -O staticroutes -V IPTV_RG"
# LAN interfaces on which IPTV should be made available
IPTV_LAN_INTERFACES="br40"
# Disable quickleave for igmpproxy
IPTV_IGMPPROXY_DISABLE_QUICKLEAVE="true"
# Enable debugging for igmpproxy
IPTV_IGMPPROXY_DEBUG="true"
IPTV_IGMPPROXY_PROGRAM="igmpproxy"

IPTV_IGMPPROXY_IGMP_VERSION="2"
````

<img width="1092" height="310" alt="Image" src="https://github.com/user-attachments/assets/c45ac172-653f-4031-bc09-3a4ecb4e8eac" />

**Comment by dmutsaers** [comment]
I don’t believe the USW‑Flex‑2.5G‑5 supports IGMP Querier or IGMP Snooping. As long as these switches remain part of the chain, multicast traffic will not function correctly.

**Comment by deomyrnl** [comment]
@dmutsaers  at this moment i connect the tv box straigt to the ucg-fiber, should that solve the problem

**Comment by erikpost** [comment]
> I will try it the following way this should work right? or doe i need to change the fast leave option:
> 
> ```
> [..]
> # DHCP options to send when requesting an IP address
> IPTV_WAN_DHCP_OPTIONS="-o -O subnet -O broadcast -O staticroutes -V IPTV_RG"
> [..]
> ```

For trined you don't need to include the `-V IPTV_RG` part in this setting, that's specific for KPN. Fast leave shouldn't have an effect, it is only relevant if you have more than one STB.

And as @dmutsaers also mentions, the USW Flexes don't support IGMP Snooping. That's why I suggested to test with STB directly connected to the UCG Fiber and disconnect the USW Flexes from your network. If that setup works, you know your issues are caused by the USW Flexes not supporting IGMP Snooping.

**Comment by dmutsaers** [comment]
In that case, I don’t see any configuration setting that would prevent IPTV multicast from functioning properly. However, I'm not familiar with TriNed-TV.

I don’t recall how igmpproxy behaved in the absence of an IGMP Querier.

**Comment by deomyrnl** [comment]
I did a lot of trying and flip some settings but it didn’t work.
After a research of the fritzbox file i might found something.
The TriNed network is screaming IGMP v3 to the UCG-Fiber and the tvbox is screaming V2 back.
In the backup of the frtizbox there are those 2 versions. i think switching back to the fritzbox is now the best option and later on  try it again. 

I tested with igmpproxy and igmp v2
and with improxy v2 and v3

````

root@UCG-Fiber:~# udm-iptv diagnose
Please share the following output with the developers:
=== Configuration ===
WAN Interface: eth4
WAN VLAN: 4 (dev iptv)
WAN DHCP: true (options "-o -O subnet -O broadcast -O staticroutes")
WAN Ranges: 0.0.0.0/0
LAN Interfaces: br40
IGMP Proxy quickleave disabled: true
IGMP Proxy debug: true
=== IP Link and Route ===
29: iptv@eth4: <BROADCAST,MULTICAST,UP,LOWER_UP> mtu 1500 qdisc noqueue state UP group default qlen 1000
    inet 10.61.131.94/10 scope global iptv
       valid_lft forever preferred_lft forever
10.0.0.0/10 proto kernel scope link src 10.61.131.94
=== Service Logs ===
Apr 12 22:08:29 UCG-Fiber udm-iptvd[2967345]: RECV V2 member report   from 192.168.40.1    to 224.0.0.22
Apr 12 22:08:29 UCG-Fiber udm-iptvd[2967345]: The IGMP message was from myself. Ignoring.
Apr 12 22:08:31 UCG-Fiber udm-iptvd[2967345]: Removing MFC: 192.168.40.1 -> 224.0.37.42, InpVIf: 1
Apr 12 22:08:31 UCG-Fiber udm-iptvd[2967345]: MRT_DEL_MFC; Errno(2): No such file or directory
Apr 12 22:08:32 UCG-Fiber udm-iptvd[2967345]: RECV V2 member report   from 192.168.40.1    to 224.0.0.106
Apr 12 22:08:32 UCG-Fiber udm-iptvd[2967345]: The IGMP message was from myself. Ignoring.
Apr 12 22:08:33 UCG-Fiber udm-iptvd[2967345]: RECV Leave message      from 192.168.40.1    to 224.0.0.2
Apr 12 22:08:33 UCG-Fiber udm-iptvd[2967345]: Route activation request from 10.61.131.94 for 233.89.188.1 is from myself. Ignoring.
Apr 12 22:08:33 UCG-Fiber udm-iptvd[2967345]: RECV V2 member report   from 192.168.40.1    to 233.89.188.1
Apr 12 22:08:33 UCG-Fiber udm-iptvd[2967345]: The IGMP message was from myself. Ignoring.
root@UCG-Fiber:~#

````

````
root@UCG-Fiber:~# tcpdump -i br40 igmp
tcpdump: verbose output suppressed, use -v[v]... for full protocol decode
listening on br40, link-type EN10MB (Ethernet), snapshot length 262144 bytes
07:57:49.307112 IP unifi.localdomain > igmp.mcast.net: igmp v3 report, 1 group record(s)
07:57:49.807202 IP unifi.localdomain > igmp.mcast.net: igmp v3 report, 1 group record(s)
07:57:50.747109 IP unifi.localdomain > igmp.mcast.net: igmp v3 report, 1 group record(s)
07:57:59.807251 IP unifi.localdomain > igmp.mcast.net: igmp v3 report, 1 group record(s)
07:58:00.297134 IP unifi.localdomain > igmp.mcast.net: igmp v3 report, 1 group record(s)
07:58:01.067116 IP unifi.localdomain > igmp.mcast.net: igmp v3 report, 1 group record(s)
07:58:10.307155 IP unifi.localdomain > igmp.mcast.net: igmp v3 report, 1 group record(s)
07:58:10.797162 IP unifi.localdomain > igmp.mcast.net: igmp v3 report, 1 group record(s)
07:58:11.067119 IP unifi.localdomain > igmp.mcast.net: igmp v3 report, 1 group record(s)
07:58:20.807110 IP unifi.localdomain > igmp.mcast.net: igmp v3 report, 1 group record(s)
07:58:20.977135 IP unifi.localdomain > igmp.mcast.net: igmp v3 report, 1 group record(s)
07:58:21.307116 IP unifi.localdomain > igmp.mcast.net: igmp v3 report, 1 group record(s)
07:58:21.387135 IP unifi.localdomain > igmp.mcast.net: igmp v3 report, 1 group record(s)
07:58:31.307235 IP unifi.localdomain > igmp.mcast.net: igmp v3 report, 1 group record(s)
07:58:31.807172 IP unifi.localdomain > igmp.mcast.net: igmp v3 report, 1 group record(s)
07:58:32.087119 IP unifi.localdomain > igmp.mcast.net: igmp v3 report, 1 group record(s)
07:58:33.178421 IP 192.168.40.94 > 225.0.71.1: igmp v2 report 225.0.71.1
07:58:33.714580 IP 192.168.40.94 > 239.3.4.17: igmp v2 report 239.3.4.17
07:58:41.817159 IP unifi.localdomain > igmp.mcast.net: igmp v3 report, 1 group record(s)
07:58:42.107114 IP unifi.localdomain > igmp.mcast.net: igmp v3 report, 1 group record(s)
07:58:42.307185 IP unifi.localdomain > igmp.mcast.net: igmp v3 report, 1 group record(s)
07:58:43.067115 IP unifi.localdomain > igmp.mcast.net: igmp v3 report, 1 group record(s)
07:58:43.347197 IP unifi.localdomain > all-systems.mcast.net: igmp query v3
07:58:51.205987 IP 192.168.40.94 > 239.3.4.17: igmp v2 report 239.3.4.17
07:58:51.622059 IP 192.168.40.94 > 225.0.71.1: igmp v2 report 225.0.71.1
07:58:52.317157 IP unifi.localdomain > igmp.mcast.net: igmp v3 report, 1 group record(s)
07:58:52.817117 IP unifi.localdomain > igmp.mcast.net: igmp v3 report, 1 group record(s)
07:58:53.627113 IP unifi.localdomain > igmp.mcast.net: igmp v3 report, 1 group record(s)
07:59:02.807157 IP unifi.localdomain > igmp.mcast.net: igmp v3 report, 1 group record(s)
07:59:03.327157 IP unifi.localdomain > igmp.mcast.net: igmp v3 report, 1 group record(s)
07:59:03.357134 IP unifi.localdomain > igmp.mcast.net: igmp v3 report, 1 group record(s)
07:59:13.337108 IP unifi.localdomain > igmp.mcast.net: igmp v3 report, 1 group record(s)
07:59:13.817137 IP unifi.localdomain > igmp.mcast.net: igmp v3 report, 1 group record(s)
07:59:14.207130 IP unifi.localdomain > igmp.mcast.net: igmp v3 report, 1 group record(s)
07:59:23.817173 IP unifi.localdomain > igmp.mcast.net: igmp v3 report, 1 group record(s)
07:59:24.307152 IP unifi.localdomain > igmp.mcast.net: igmp v3 report, 1 group record(s)
07:59:24.437134 IP unifi.localdomain > igmp.mcast.net: igmp v3 report, 1 group record(s)
07:59:32.943377 IP 192.168.40.94 > 225.0.71.1: igmp v2 report 225.0.71.1
07:59:33.391382 IP 192.168.40.94 > 239.3.4.17: igmp v2 report 239.3.4.17
07:59:34.307119 IP unifi.localdomain > igmp.mcast.net: igmp v3 report, 1 group record(s)
07:59:34.367114 IP unifi.localdomain > igmp.mcast.net: igmp v3 report, 1 group record(s)
07:59:34.817168 IP unifi.localdomain > igmp.mcast.net: igmp v3 report, 1 group record(s)
07:59:35.637116 IP unifi.localdomain > igmp.mcast.net: igmp v3 report, 1 group record(s)
07:59:44.817221 IP unifi.localdomain > igmp.mcast.net: igmp v3 report, 1 group record(s)
07:59:45.207147 IP unifi.localdomain > igmp.mcast.net: igmp v3 report, 1 group record(s)
07:59:45.307123 IP unifi.localdomain > igmp.mcast.net: igmp v3 report, 1 group record(s)
07:59:45.937116 IP unifi.localdomain > igmp.mcast.net: igmp v3 report, 1 group record(s)
07:59:55.307139 IP unifi.localdomain > igmp.mcast.net: igmp v3 report, 1 group record(s)
07:59:55.807120 IP unifi.localdomain > igmp.mcast.net: igmp v3 report, 1 group record(s)
07:59:56.747163 IP unifi.localdomain > igmp.mcast.net: igmp v3 report, 1 group record(s)
08:00:05.807119 IP unifi.localdomain > igmp.mcast.net: igmp v3 report, 1 group record(s)
08:00:06.307328 IP unifi.localdomain > igmp.mcast.net: igmp v3 report, 1 group record(s)
08:00:06.557139 IP unifi.localdomain > igmp.mcast.net: igmp v3 report, 1 group record(s)
08:00:16.327176 IP unifi.localdomain > igmp.mcast.net: igmp v3 report, 1 group record(s)
08:00:16.827174 IP unifi.localdomain > igmp.mcast.net: igmp v3 report, 1 group record(s)
08:00:17.717108 IP unifi.localdomain > igmp.mcast.net: igmp v3 report, 1 group record(s)
08:00:26.827212 IP unifi.localdomain > igmp.mcast.net: igmp v3 report, 1 group record(s)
08:00:27.307151 IP unifi.localdomain > igmp.mcast.net: igmp v3 report, 1 group record(s)
08:00:27.867123 IP unifi.localdomain > igmp.mcast.net: igmp v3 report, 1 group record(s)
08:00:32.426064 IP 192.168.40.94 > 239.3.4.17: igmp v2 report 239.3.4.17
08:00:33.439981 IP 192.168.40.94 > 225.0.71.1: igmp v2 report 225.0.71.1
08:00:37.307154 IP unifi.localdomain > igmp.mcast.net: igmp v3 report, 1 group record(s)
08:00:37.637175 IP unifi.localdomain > igmp.mcast.net: igmp v3 report, 1 group record(s)
08:00:37.807189 IP unifi.localdomain > igmp.mcast.net: igmp v3 report, 1 group record(s)
08:00:38.297164 IP unifi.localdomain > igmp.mcast.net: igmp v3 report, 1 group record(s)
^C
65 packets captured
67 packets received by filter
0 packets dropped by kernel
root@UCG-Fiber:~# ^C

````
````
root@UCG-Fiber:~# tcpdump -i iptv igmp
tcpdump: verbose output suppressed, use -v[v]... for full protocol decode
listening on iptv, link-type EN10MB (Ethernet), snapshot length 262144 bytes
07:58:31.307262 IP 10.61.131.94 > igmp.mcast.net: igmp v3 report, 1 group record(s)
07:58:31.341990 IP unifi.localdomain > all-systems.mcast.net: igmp query v3
07:58:31.527120 IP 10.61.131.94 > igmp.mcast.net: igmp v3 report, 1 group record(s)
07:58:31.807113 IP 10.61.131.94 > igmp.mcast.net: igmp v3 report, 1 group record(s)
07:58:32.217142 IP 10.61.131.94 > igmp.mcast.net: igmp v3 report, 1 group record(s)
07:58:41.817114 IP 10.61.131.94 > igmp.mcast.net: igmp v3 report, 1 group record(s)
07:58:42.307116 IP 10.61.131.94 > igmp.mcast.net: igmp v3 report, 1 group record(s)
07:58:42.797143 IP 10.61.131.94 > igmp.mcast.net: igmp v3 report, 1 group record(s)
07:58:52.317108 IP 10.61.131.94 > igmp.mcast.net: igmp v3 report, 1 group record(s)
07:58:52.807136 IP 10.61.131.94 > igmp.mcast.net: igmp v3 report, 1 group record(s)
07:58:53.437112 IP 10.61.131.94 > igmp.mcast.net: igmp v3 report, 1 group record(s)
07:59:02.807135 IP 10.61.131.94 > igmp.mcast.net: igmp v3 report, 1 group record(s)
07:59:02.997104 IP 10.61.131.94 > igmp.mcast.net: igmp v3 report, 1 group record(s)
07:59:03.327126 IP 10.61.131.94 > igmp.mcast.net: igmp v3 report, 1 group record(s)
07:59:04.267122 IP 10.61.131.94 > igmp.mcast.net: igmp v3 report, 1 group record(s)
07:59:13.327111 IP 10.61.131.94 > igmp.mcast.net: igmp v3 report, 1 group record(s)
07:59:13.757140 IP 10.61.131.94 > igmp.mcast.net: igmp v3 report, 1 group record(s)
07:59:13.817137 IP 10.61.131.94 > igmp.mcast.net: igmp v3 report, 1 group record(s)
07:59:14.747116 IP 10.61.131.94 > igmp.mcast.net: igmp v3 report, 1 group record(s)
07:59:23.817108 IP 10.61.131.94 > igmp.mcast.net: igmp v3 report, 1 group record(s)
07:59:24.057110 IP 10.61.131.94 > igmp.mcast.net: igmp v3 report, 1 group record(s)
07:59:24.307152 IP 10.61.131.94 > igmp.mcast.net: igmp v3 report, 1 group record(s)
07:59:24.467152 IP 10.61.131.94 > igmp.mcast.net: igmp v3 report, 1 group record(s)
07:59:34.317106 IP 10.61.131.94 > igmp.mcast.net: igmp v3 report, 1 group record(s)
07:59:34.817115 IP 10.61.131.94 > igmp.mcast.net: igmp v3 report, 1 group record(s)
07:59:35.007113 IP 10.61.131.94 > igmp.mcast.net: igmp v3 report, 1 group record(s)
07:59:44.817132 IP 10.61.131.94 > igmp.mcast.net: igmp v3 report, 1 group record(s)
07:59:45.307123 IP 10.61.131.94 > igmp.mcast.net: igmp v3 report, 1 group record(s)
07:59:45.407135 IP 10.61.131.94 > igmp.mcast.net: igmp v3 report, 1 group record(s)
07:59:55.317114 IP 10.61.131.94 > igmp.mcast.net: igmp v3 report, 1 group record(s)
07:59:55.817112 IP 10.61.131.94 > igmp.mcast.net: igmp v3 report, 1 group record(s)
07:59:56.327129 IP 10.61.131.94 > igmp.mcast.net: igmp v3 report, 1 group record(s)
08:00:05.827108 IP 10.61.131.94 > igmp.mcast.net: igmp v3 report, 1 group record(s)
08:00:06.217192 IP 10.61.131.94 > igmp.mcast.net: igmp v3 report, 1 group record(s)
08:00:06.317126 IP 10.61.131.94 > igmp.mcast.net: igmp v3 report, 1 group record(s)
08:00:06.477112 IP 10.61.131.94 > igmp.mcast.net: igmp v3 report, 1 group record(s)
08:00:16.327134 IP 10.61.131.94 > igmp.mcast.net: igmp v3 report, 1 group record(s)
08:00:16.837125 IP 10.61.131.94 > igmp.mcast.net: igmp v3 report, 1 group record(s)
08:00:17.627115 IP 10.61.131.94 > igmp.mcast.net: igmp v3 report, 1 group record(s)
08:00:26.837110 IP 10.61.131.94 > igmp.mcast.net: igmp v3 report, 1 group record(s)
08:00:27.307120 IP 10.61.131.94 > igmp.mcast.net: igmp v3 report, 1 group record(s)
08:00:27.517138 IP 10.61.131.94 > igmp.mcast.net: igmp v3 report, 1 group record(s)
08:00:36.351760 IP unifi.localdomain > all-systems.mcast.net: igmp query v3
08:00:37.317143 IP 10.61.131.94 > igmp.mcast.net: igmp v3 report, 1 group record(s)
08:00:37.547153 IP 10.61.131.94 > igmp.mcast.net: igmp v3 report, 1 group record(s)
08:00:37.807123 IP 10.61.131.94 > igmp.mcast.net: igmp v3 report, 1 group record(s)
08:00:38.097128 IP 10.61.131.94 > igmp.mcast.net: igmp v3 report, 1 group record(s)
08:00:47.807185 IP 10.61.131.94 > igmp.mcast.net: igmp v3 report, 1 group record(s)
08:00:48.307153 IP 10.61.131.94 > igmp.mcast.net: igmp v3 report, 1 group record(s)
08:00:48.827143 IP 10.61.131.94 > igmp.mcast.net: igmp v3 report, 1 group record(s)

50 packets captured
51 packets received by filter
0 packets dropped by kernel
^Croot@UCG-Fiber:~# ^C

````

**Comment by deomyrnl** [comment]
@erikpost @dmutsaers 
Hey Guys,

I got the tv working with the following config.
````
IPTV_WAN_INTERFACE="eth4"
IPTV_WAN_VLAN="4"
IPTV_WAN_VLAN_INTERFACE="iptv"
IPTV_WAN_RANGES="0.0.0.0/0"
IPTV_WAN_DHCP_OPTIONS="-o -O subnet -O broadcast -O staticroutes"
IPTV_LAN_INTERFACES="br40"
IPTV_IGMPPROXY_DISABLE_QUICKLEAVE="false"
IPTV_IGMPPROXY_DEBUG="true"
IPTV_IGMPPROXY_PROGRAM="igmpproxy"
IPTV_IGMPPROXY_IGMP_VERSION="2"
IPTV_WAN_VLAN_MAC="**:**:**:8E:16:4B"
````
After running systemctl restart udm-iptv or systemctl start udm-iptv i need to run the following commands and the steam is running flawless. (im still testing with step 2 and 3)
````
# 1. Allow IGMP traffic exclusively on the dedicated IPTV VLAN interface
iptables -I INPUT -i iptv -p igmp -j ACCEPT
iptables -I FORWARD -i iptv -p igmp -j ACCEPT

# 2. Relax the 'Martian Packet' filter ONLY as much as necessary.
# Set global to '2' (Loose mode) to preserve basic spoofing protection.
# Set 'iptv' to '0' to allow the required asymmetric multicast routing.
echo 2 > /proc/sys/net/ipv4/conf/all/rp_filter
echo 0 > /proc/sys/net/ipv4/conf/iptv/rp_filter

# 3. Allow TriNed to use blank IPs (0.0.0.0) strictly confined to the iptv interface
echo 1 > /proc/sys/net/ipv4/conf/iptv/accept_local
````

**Comment by deomyrnl** [comment]
After a couple of restarts it is still running with the above commands after the start of the script with the following config
````
# Example configuration for udmp-iptv ##
# Interface on which IPTV traffic enters the router
IPTV_WAN_INTERFACE="eth4"
# ID of VLAN which carries IPTV traffic (use 0 if no VLAN is used)
IPTV_WAN_VLAN="4"
# Name of the IPTV VLAN interface
IPTV_WAN_VLAN_INTERFACE="iptv"
# IP ranges from which the IPTV traffic originates (separated by spaces)
IPTV_WAN_RANGES="0.0.0.0/0"
# DHCP options to send when requesting an IP address
IPTV_WAN_DHCP_OPTIONS="-o -O subnet -O broadcast -O staticroutes"
# LAN interfaces on which IPTV should be made available
IPTV_LAN_INTERFACES="br40"
# Disable quickleave for igmpproxy
IPTV_IGMPPROXY_DISABLE_QUICKLEAVE="false"
# Enable debugging for igmpproxy
IPTV_IGMPPROXY_DEBUG="true"
IPTV_IGMPPROXY_PROGRAM="igmpproxy"

IPTV_IGMPPROXY_IGMP_VERSION="2"
````

**Comment by erikpost** [comment]
Great, not far from the config proposed in one of the replies to your initial post 😉
But judging from other experiences it seems that `improxy` doesn't work very well anymore with the IGMP snooping changes introduced by Ubiquiti. `igmpproxy` seems to work better now.

**Comment by deomyrnl** [comment]
@erikpost  and the commands after every restart 

````

# 1. Allow IGMP traffic exclusively on the dedicated IPTV VLAN interface
iptables -I INPUT -i iptv -p igmp -j ACCEPT
iptables -I FORWARD -i iptv -p igmp -j ACCEPT

# 2. Relax the 'Martian Packet' filter ONLY as much as necessary.
# Set global to '2' (Loose mode) to preserve basic spoofing protection.
# Set 'iptv' to '0' to allow the required asymmetric multicast routing.
echo 2 > /proc/sys/net/ipv4/conf/all/rp_filter
echo 0 > /proc/sys/net/ipv4/conf/iptv/rp_filter

# 3. Allow TriNed to use blank IPs (0.0.0.0) strictly confined to the iptv interface
echo 1 > /proc/sys/net/ipv4/conf/iptv/accept_local

````

Then it works like a charm

**Comment by antoniodejager** [comment]
the real fix seems to be the last step, thanks for that! Works as well for CanalDigital in NL/Freedom Internet

**Comment by deomyrnl** [comment]
@antoniodejager 
My apologies for the late response. I changed my script to only run the last step. Indeed, even after every UniFi OS update, running my own script and then the 'fabianshere' script works like a charm
