### DISCUSSION TITLE
Feature request: Add support for UXG-Lite

### DISCUSSION THREAD

**Discussion by dmutsaers** [fabianishere/udm-iptv#286] [Ideas]
Would it be possible to add support for the Ubiquiti Next-Gen Gateway Lite (UXG-Lite)?
[https://eu.store.ui.com/eu/en/pro/category/all-cloud-keys-gateways/products/uxg-lite](url)

**Comment by exiztencenl** [comment]
Please do so I can place my Usg with an Uxg lite :-)

**Comment by HarmvandenBrink** [comment]
I tried to use it on an UGX Lite, getting internet to work with KPN FTTH just works fine.

However, IPTV doesn't work. The KPN TV is working for 2 seconds, and then stops...

```
Please share the following output with the developers:
=== Configuration ===
WAN Interface: eth1
WAN VLAN: 4 (dev iptv)
WAN DHCP: true (options "-O staticroutes -V IPTV_RG")
WAN Ranges: 213.75.0.0/16  217.166.0.0/16
LAN Interfaces: eth0.661
IGMP Proxy quickleave disabled: false
IGMP Proxy debug: true
=== IP Link and Route ===
18: iptv@eth1: <BROADCAST,MULTICAST,UP,LOWER_UP> mtu 1500 qdisc noqueue state UP group default qlen 1000
    inet 10.95.138.81/22 brd 10.95.139.255 scope global iptv
       valid_lft forever preferred_lft forever
10.95.136.0/22 proto kernel scope link src 10.95.138.81
213.75.112.0/21 via 10.95.136.1 metric 218
=== Service Logs ===
Nov 22 17:59:54 UXG-Lite udm-iptvd[2467]: RECV Membership query   from 10.1.100.1      to 224.0.0.1
Nov 22 17:59:55 UXG-Lite udm-iptvd[2467]: RECV Leave message      from 10.1.100.164    to 224.0.0.2
Nov 22 17:59:55 UXG-Lite udm-iptvd[2467]: RECV Membership query   from 10.1.100.1      to 224.3.2.6
Nov 22 17:59:55 UXG-Lite udm-iptvd[2467]: RECV V2 member report   from 10.1.100.164    to 224.3.2.6
Nov 22 17:59:55 UXG-Lite udm-iptvd[2467]: Updated route entry for 224.3.2.6 on VIF #0
Nov 22 17:59:57 UXG-Lite udm-iptvd[2467]: RECV V2 member report   from 10.1.100.19     to 224.3.2.6
Nov 22 17:59:57 UXG-Lite udm-iptvd[2467]: Updated route entry for 224.3.2.6 on VIF #0
Nov 22 17:59:59 UXG-Lite udm-iptvd[2467]: The IGMP message was local multicast. Ignoring.
Nov 22 18:00:03 UXG-Lite udm-iptvd[2467]: RECV V2 member report   from 10.1.100.1      to 224.0.0.2
Nov 22 18:00:03 UXG-Lite udm-iptvd[2467]: The IGMP message was from myself. Ignoring.
```

I changed the WAN interface to eth1, and the LAN interfaces to eth0.661 (since VLAN 661 is where my IPTV VLAN runs on).

Any ideas what I should do? I had to install the igmpporxy manually (apt update, apt install igmpproxy)

**Reply by fabianishere** [reply]
Can you share the output of `ip a`?

**Reply by dmutsaers** [reply]
>  I had to install the igmpporxy manually (apt update, apt install igmpproxy)

I presumed that igmpproxy has been replaced with improxy

**Reply by HarmvandenBrink** [reply]
Both didn't get installed by the script, I had to install it manually or I got an error that igmpproxy isn't there.

I think there's an issue with the igmpproxy and some routing

**Comment by HarmvandenBrink** [comment]
root@UXG-Lite:~# ip a
1: lo: <LOOPBACK,UP,LOWER_UP> mtu 65536 qdisc noqueue state UNKNOWN group default qlen 1
    link/loopback da:b3:70:85:99:e5 brd 00:00:00:00:00:00
    inet 127.0.0.1/8 scope host lo
       valid_lft forever preferred_lft forever
    inet6 ::1/128 scope host
       valid_lft forever preferred_lft forever
2: dummy0: <BROADCAST,NOARP> mtu 1500 qdisc noop state DOWN group default qlen 1000
    link/ether 36:b4:91:25:96:18 brd ff:ff:ff:ff:ff:ff
3: gre0@NONE: <NOARP> mtu 1476 qdisc noop state DOWN group default qlen 1
    link/gre 0.0.0.0 brd 0.0.0.0
4: gretap0@NONE: <BROADCAST,MULTICAST> mtu 1462 qdisc noop state DOWN group default qlen 1000
    link/ether 00:00:00:00:00:00 brd ff:ff:ff:ff:ff:ff
5: ip_vti0@NONE: <NOARP> mtu 1332 qdisc noop state DOWN group default qlen 1
    link/ipip 0.0.0.0 brd 0.0.0.0
6: ip6_vti0@NONE: <NOARP> mtu 1500 qdisc noop state DOWN group default qlen 1
    link/tunnel6 :: brd ::
7: sit0@NONE: <NOARP> mtu 1480 qdisc noop state DOWN group default qlen 1
    link/sit 0.0.0.0 brd 0.0.0.0
8: ip6tnl0@NONE: <NOARP> mtu 1452 qdisc noop state DOWN group default qlen 1
    link/tunnel6 :: brd ::
9: eth0: <BROADCAST,MULTICAST,UP,LOWER_UP> mtu 1500 qdisc mq master br0 state UP group default qlen 1000
    link/ether d8:b3:70:85:99:e5 brd ff:ff:ff:ff:ff:ff
    inet6 fe80::dab3:70ff:fe85:99e5/64 scope link
       valid_lft forever preferred_lft forever
10: eth1: <BROADCAST,MULTICAST,UP,LOWER_UP> mtu 1500 qdisc mq state UP group default qlen 1000
    link/ether d8:b3:70:85:99:e6 brd ff:ff:ff:ff:ff:ff
    inet6 fe80::dab3:70ff:fe85:99e6/64 scope link
       valid_lft forever preferred_lft forever
11: ifb0: <BROADCAST,NOARP> mtu 1500 qdisc noop state DOWN group default qlen 32
    link/ether 22:30:9c:c7:f1:6d brd ff:ff:ff:ff:ff:ff
12: ifb1: <BROADCAST,NOARP> mtu 1500 qdisc noop state DOWN group default qlen 32
    link/ether aa:0e:b0:cc:b6:13 brd ff:ff:ff:ff:ff:ff
13: br0: <BROADCAST,MULTICAST,UP,LOWER_UP> mtu 1500 qdisc noqueue state UP group default qlen 1000
    link/ether d8:b3:70:85:99:e5 brd ff:ff:ff:ff:ff:ff
    inet 192.168.1.1/24 scope global br0
       valid_lft forever preferred_lft forever
    inet6 2a02:a450:2b55::1/64 scope global dynamic
       valid_lft 256477sec preferred_lft 170077sec
    inet6 fe80::dab3:70ff:fe85:99e5/64 scope link
       valid_lft forever preferred_lft forever
14: eth0.100@eth0: <BROADCAST,MULTICAST,UP,LOWER_UP> mtu 1500 qdisc noqueue state UP group default qlen 1000
    link/ether d8:b3:70:85:99:e5 brd ff:ff:ff:ff:ff:ff
    inet 10.1.1.1/24 scope global eth0.100
       valid_lft forever preferred_lft forever
    inet6 fe80::dab3:70ff:fe85:99e5/64 scope link
       valid_lft forever preferred_lft forever
15: eth0.661@eth0: <BROADCAST,MULTICAST,UP,LOWER_UP> mtu 1500 qdisc noqueue state UP group default qlen 1000
    link/ether d8:b3:70:85:99:e5 brd ff:ff:ff:ff:ff:ff
    inet 10.1.100.1/24 scope global eth0.661
       valid_lft forever preferred_lft forever
    inet6 fe80::dab3:70ff:fe85:99e5/64 scope link
       valid_lft forever preferred_lft forever
16: eth1.6@eth1: <BROADCAST,MULTICAST,UP,LOWER_UP> mtu 1500 qdisc noqueue state UP group default qlen 1000
    link/ether d8:b3:70:85:99:e6 brd ff:ff:ff:ff:ff:ff
    inet6 fe80::dab3:70ff:fe85:99e6/64 scope link
       valid_lft forever preferred_lft forever
17: ppp0: <POINTOPOINT,MULTICAST,NOARP,UP,LOWER_UP> mtu 1492 qdisc fq_codel state UNKNOWN group default qlen 3
    link/ppp
    inet 80.61.194.94 peer 195.190.228.52/32 scope global ppp0
       valid_lft forever preferred_lft forever
    inet6 fe80::b10c:4650:b531:aa8a/128 scope link
       valid_lft forever preferred_lft forever
18: iptv@eth1: <BROADCAST,MULTICAST,UP,LOWER_UP> mtu 1500 qdisc noqueue state UP group default qlen 1000
    link/ether d8:b3:70:85:99:e6 brd ff:ff:ff:ff:ff:ff
    inet 10.95.138.161/22 brd 10.95.139.255 scope global iptv
       valid_lft forever preferred_lft forever
    inet6 fe80::dab3:70ff:fe85:99e6/64 scope link
       valid_lft forever preferred_lft forever

**Comment by dmutsaers** [comment]
@HarmvandenBrink Did you manage to get it up and running in the meantime?

 I think we need an update like the one recently added for the UXG-Pro
 https://github.com/fabianishere/udm-iptv/pull/261

**Reply by mgiebels** [reply]
i have the UXG lite also how can we get these update?

**Reply by dmutsaers** [reply]
Well, someone has to build a patch/revision. I don't have the knowledge how to do this, sadly.

**Comment by dmutsaers** [comment]
Add a new device to the list, UniFi Express (UX) 😉
https://ui.com/cloud-gateways/express

**Reply by dmutsaers** [reply]
See https://github.com/fabianishere/udm-iptv/discussions/292

**Comment by locmer** [comment]
Looks like there are known issues with the advertised IGMP proxy. The product page used to state it was supported but that looks removed (I think). I bought it because it would support this. 

https://community.ui.com/questions/UXG-Lite-How-to-Turn-on-Configure-IGMP-Proxy/cd607cd8-b1f4-431b-b3d3-782738513c3f?page=1

**Reply by dmutsaers** [reply]
That's really bad news... 🥺

**Comment by fabianishere** [comment]
Could someone share with me the output of the following commands?

```
cat /etc/board.info
cat /proc/ubnthal/system.info
```

Also, while running the script, please share the following:

```
ip mroute show
```

**Reply by simonalbrecht** [reply]
`/etc/board.info`:

```
board.sysid=0xa677
board.name=UniFi NeXt-Gen Gateway Lite
board.shortname=UXG
board.subtype=
board.hwaddr=D8B370XXXXXX
board.reboot=90
board.upgrade=120
board.phycount=2
board.required_fw_version=3.1.0
board.cpurevision=0x101540e1
```

`/proc/ubnthal/system.info`:

```
cpu=Maple 1.1
cpuid=101540e1
flashSize=33554432
ramsize=1073741824
vendorid=0777
systemid=a677
shortname=UXG
boardrevision=4
serialno=d8b370XXXXXX
manufid=003d
mfgweek=202333
qrid=KARMPw
eth0.macaddr=d8:b3:70:XX:XX:XX
eth1.macaddr=d8:b3:70:XX:XX:XX
device.hashid=f9cf18e739XXXXXX
device.anonid=09f9a29e-14fd-459f-XXXX-XXXXXXXXXXXX
bt0.macaddr=d8:b3:70:XX:XX:XX
cpu_rev_id=101540e1
```

**Comment by marcelvanveen** [comment]
Allright, running into all the same issues mentioned here. Had to manually install igmpproxy, otherwise it wouldn't work at all.

Full log of installation:
```
root@UXG-Lite:/etc# sh -c "$(curl https://raw.githubusercontent.com/fabianishere/udm-iptv/master/install.sh -sSf)"
Downloading packages...
Installing packages...
E: The update command takes no arguments
Reading package lists...
E: Unsupported file /dev/null given on commandline
Failed to install dialog... Using readline frontend
Reading package lists...
Building dependency tree...
Reading state information...
Suggested packages:
  igmpproxy
Recommended packages:
  improxy
The following NEW packages will be installed:
  udm-iptv
0 upgraded, 1 newly installed, 0 to remove and 47 not upgraded.
After this operation, 72.7 kB of additional disk space will be used.
Get:1 /tmp/tmp.rK4T2XhqZD/udm-iptv.deb udm-iptv all 3.0.3 [16.4 kB]
debconf: unable to initialize frontend: Dialog
debconf: (No usable dialog-like program is installed, so the dialog based frontend cannot be used. at /usr/share/perl5/Debconf/FrontEnd/Dialog.pm line 78, <> line 1.)
debconf: falling back to frontend: Readline
Preconfiguring packages ...
/tmp/udm-iptv.config.FEDr1a: 142: .: cannot open /usr/lib/udm-iptv/profiles/kpn.profile: No such file
udm-iptv failed to preconfigure, with exit status 2
Selecting previously unselected package udm-iptv.
(Reading database ... 23814 files and directories currently installed.)
Preparing to unpack .../tmp.rK4T2XhqZD/udm-iptv.deb ...
Unpacking udm-iptv (3.0.3) ...
Setting up udm-iptv (3.0.3) ...
debconf: unable to initialize frontend: Dialog
debconf: (No usable dialog-like program is installed, so the dialog based frontend cannot be used. at /usr/share/perl5/Debconf/FrontEnd/Dialog.pm line 78.)
debconf: falling back to frontend: Readline
W: Repository is broken: udm-iptv:arm64 (= 3.0.3) has no Size information
Installation successful... You can find your configuration at /etc/udm-iptv.conf.

Use the following command to reconfigure the script:

	 udm-iptv reconfigure
```

**Comment by marcelvanveen** [comment]
Regarding the actual issue here - I think it's a downstream issue. If I run `tcpdump -i iptv`, I see incoming TV traffic even after the STB reaches the error screen. This traffic stops after the timeout of IGMP or if I turn off the STB. However, I don't see any multicast traffic on the TV LAN interface...

`udm-iptv-diag`:
```
Please share the following output with the developers:
=== Configuration ===
WAN Interface: eth1
WAN VLAN: 4 (dev iptv)
WAN DHCP: true (options "-O staticroutes -V IPTV_RG")
WAN Ranges: 213.75.0.0/16  217.166.0.0/16
LAN Interfaces: eth0.3
IGMP Proxy quickleave disabled: false
IGMP Proxy debug: true
=== IP Link and Route ===
22: iptv@eth1: <BROADCAST,MULTICAST,UP,LOWER_UP> mtu 1500 qdisc noqueue state UP group default qlen 1000
    inet 10.180.213.77/22 brd 10.180.215.255 scope global iptv
       valid_lft forever preferred_lft forever
10.180.212.0/22 proto kernel scope link src 10.180.213.77 
213.75.112.0/21 via 10.180.212.1 metric 222 
=== Service Logs ===
Dec 06 19:19:54 UXG-Lite udm-iptvd[118514]: RECV V2 member report   from 192.168.3.110   to 224.3.2.6
Dec 06 19:19:54 UXG-Lite udm-iptvd[118514]: Updated route entry for 224.3.2.6 on VIF #0
Dec 06 19:19:54 UXG-Lite udm-iptvd[118514]: The IGMP message was local multicast. Ignoring.
Dec 06 19:19:59 UXG-Lite udm-iptvd[118514]: RECV Membership query   from 192.168.3.1     to 224.0.0.1
Dec 06 19:20:00 UXG-Lite udm-iptvd[118514]: RECV V2 member report   from 192.168.3.1     to 224.0.0.22
Dec 06 19:20:00 UXG-Lite udm-iptvd[118514]: The IGMP message was from myself. Ignoring.
Dec 06 19:20:03 UXG-Lite udm-iptvd[118514]: RECV V2 member report   from 192.168.3.1     to 224.0.0.2
Dec 06 19:20:03 UXG-Lite udm-iptvd[118514]: The IGMP message was from myself. Ignoring.
Dec 06 19:20:04 UXG-Lite udm-iptvd[118514]: RECV V2 member report   from 192.168.3.101   to 224.3.2.6
Dec 06 19:20:04 UXG-Lite udm-iptvd[118514]: Updated route entry for 224.3.2.6 on VIF #0
```

`tcpdump -i eth0.3 224.0.0.0/4`:
```
root@UXG-Lite:~# tcpdump -i eth0.3 net 224.0.0.0/4
tcpdump: verbose output suppressed, use -v[v]... for full protocol decode
listening on eth0.3, link-type EN10MB (Ethernet), snapshot length 262144 bytes
19:19:34.833621 IP HMB2260_C578D0 > 224.3.2.6: igmp v2 report 224.3.2.6
19:19:35.633628 IP 192.168.3.110 > 239.255.255.250: igmp v2 report 239.255.255.250
19:19:35.863851 IP HMB2260_C578D0 > all-routers.mcast.net: igmp leave 224.0.252.135
19:19:35.864583 IP 192.168.3.1 > 224.0.252.135: igmp query v2 [gaddr 224.0.252.135]
19:19:37.884701 IP HMB2260_C578D0 > 224.0.252.135: igmp v2 report 224.0.252.135
19:19:43.304301 IP HMB2260_C578D0 > all-routers.mcast.net: igmp leave 224.0.252.135
19:19:43.305037 IP 192.168.3.1 > 224.0.252.135: igmp query v2 [gaddr 224.0.252.135]
19:19:43.623986 IP HMB2260_C578D0 > 224.0.252.135: igmp v2 report 224.0.252.135
19:19:46.628100 IP 192.168.3.1 > all-systems.mcast.net: igmp query v2
19:19:49.828221 IP 192.168.3.1 > all-routers.mcast.net: igmp v2 report all-routers.mcast.net
19:19:50.258155 IP 192.168.3.1 > igmp.mcast.net: igmp v2 report igmp.mcast.net
19:19:51.234568 IP HMB2260_C578D0 > 224.0.252.135: igmp v2 report 224.0.252.135
19:19:51.524517 IP HMB2260_C578D0 > 224.3.2.6: igmp v2 report 224.3.2.6
19:19:52.594707 IP HMB2260_C578D0 > 239.255.255.250: igmp v2 report 239.255.255.250
19:19:54.574817 IP 192.168.3.110 > 224.3.2.6: igmp v2 report 224.3.2.6
19:19:54.594869 IP 192.168.3.110 > 239.255.255.250: igmp v2 report 239.255.255.250
```

**Comment by dmutsaers** [comment]
Improvements
[UXG-Lite] Added IGMP Proxy support.
https://community.ui.com/releases/UniFi-NeXt-Generation-Gateways-3-1-16/554c77f9-a3c0-4f69-958f-d0a191a88bfa

**Comment by marcelvanveen** [comment]
Just installed the new firmware (3.1.16), and it seems udm-iptv is working with the following config (KPN with local IPTV VLAN 3):
```
IPTV_WAN_INTERFACE="eth1"
IPTV_WAN_VLAN="4"
IPTV_WAN_VLAN_INTERFACE="iptv"
IPTV_WAN_RANGES="213.75.0.0/16  217.166.0.0/16"
IPTV_WAN_DHCP_OPTIONS="-O staticroutes -V IPTV_RG"
IPTV_LAN_INTERFACES="eth0.3"
IPTV_IGMPPROXY_DISABLE_QUICKLEAVE="false"
IPTV_IGMPPROXY_DEBUG="true"
IPTV_IGMPPROXY_PROGRAM="igmpproxy"
IPTV_IGMPPROXY_IGMP_VERSION="2"
```

`ip mroute show` output:
```
(213.75.167.58,224.3.2.6)        Iif: iptv       Oifs: eth0.3  State: resolved
(217.166.226.136,224.0.252.136)  Iif: iptv       Oifs: eth0.3  State: resolved
(192.168.3.101,239.255.255.250)  Iif: unresolved  State: resolved
(192.168.3.110,239.255.255.250)  Iif: unresolved  State: resolved
```

`udm-iptv-diag` output:
```
=== Configuration ===
WAN Interface: eth1
WAN VLAN: 4 (dev iptv)
WAN DHCP: true (options "-O staticroutes -V IPTV_RG")
WAN Ranges: 213.75.0.0/16  217.166.0.0/16
LAN Interfaces: eth0.3
IGMP Proxy quickleave disabled: false
IGMP Proxy debug: true
=== IP Link and Route ===
21: iptv@eth1: <BROADCAST,MULTICAST,UP,LOWER_UP> mtu 1500 qdisc noqueue state UP group default qlen 1000
    inet 10.33.176.22/22 brd 10.33.179.255 scope global iptv
       valid_lft forever preferred_lft forever
10.33.176.0/22 proto kernel scope link src 10.33.176.22 
213.75.112.0/21 via 10.33.176.1 metric 221 
=== Service Logs ===
Dec 07 20:21:09 UXG-Lite udm-iptvd[14591]: The IGMP message was local multicast. Ignoring.
Dec 07 20:21:10 UXG-Lite udm-iptvd[14591]: RECV V2 member report   from 192.168.3.110   to 224.0.252.136
Dec 07 20:21:10 UXG-Lite udm-iptvd[14591]: Updated route entry for 224.0.252.136 on VIF #0
Dec 07 20:21:10 UXG-Lite udm-iptvd[14591]: Adding MFC: 217.166.226.136 -> 224.0.252.136, InpVIf: 1
Dec 07 20:21:11 UXG-Lite udm-iptvd[14591]: RECV V2 member report   from 192.168.3.1     to 224.0.0.22
Dec 07 20:21:11 UXG-Lite udm-iptvd[14591]: The IGMP message was from myself. Ignoring.
Dec 07 20:21:12 UXG-Lite udm-iptvd[14591]: RECV V2 member report   from 192.168.3.1     to 224.0.0.2
Dec 07 20:21:12 UXG-Lite udm-iptvd[14591]: The IGMP message was from myself. Ignoring.
Dec 07 20:21:14 UXG-Lite udm-iptvd[14591]: The IGMP message was local multicast. Ignoring.
Dec 07 20:21:17 UXG-Lite udm-iptvd[14591]: RECV Membership query   from 192.168.3.1     to 224.0.0.1
```

**Reply by dmutsaers** [reply]
Good to hear! 🙌

**Reply by marcelvanveen** [reply]
One small addition: I still had to manually install igmpproxy (as on 3.1.15). Something is off in the install script...

```
Downloading packages...
Installing packages...
E: The update command takes no arguments
Reading package lists...
E: Unsupported file /dev/null given on commandline
Failed to install dialog... Using readline frontend
Reading package lists...
Building dependency tree...
Suggested packages:
  igmpproxy
The following NEW packages will be installed:
  udm-iptv
0 upgraded, 1 newly installed, 0 to remove and 0 not upgraded.
Need to get 0 B/16.4 kB of archives.
After this operation, 72.7 kB of additional disk space will be used.
Get:1 /tmp/tmp.6RJ0G1uL6w/udm-iptv.deb udm-iptv all 3.0.3 [16.4 kB]
Preconfiguring packages ...
```

**Reply by HarmvandenBrink** [reply]
Nvm, you can download the 3.1.16 here: https://community.ui.com/releases/UniFi-NeXt-Generation-Gateways-3-1-16/554c77f9-a3c0-4f69-958f-d0a191a88bfa

**Reply by dmutsaers** [reply]
@marcelvanveen It looks like your patch "[Add support for UXG Lite LAN interfaces](https://github.com/fabianishere/udm-iptv/commit/aee66a19001d579896752fc8505b5acd046a7218)" has been commited. However, I'm not sure the issue with VLANs haven been fixed on the UXG-Lite.
[Add support for UXG Lite LAN interfaces](https://github.com/fabianishere/udm-iptv/commit/aee66a19001d579896752fc8505b5acd046a7218)

**Reply by marcelvanveen** [reply]
It's committed - but no new version is released just yet. Did you test with the latest main branch or the release 3.0.4 version?

**Reply by dmutsaers** [reply]
I tested the release 3.0.4 version, not knowing how to update to the main branch.

**Comment by mgiebels** [comment]
Update is a must!
But is it normal that you must reinstall the script? these was gone after update

root@UXG-Lite:~# udm-iptv diagnose
Please share the following output with the developers:
=== Configuration ===
WAN Interface: eth1
WAN VLAN: 4 (dev iptv)
WAN DHCP: true (options "-O staticroutes -V IPTV_RG")
WAN Ranges: 213.75.0.0/16  217.166.0.0/16
LAN Interfaces: eth0.661
IGMP Proxy quickleave disabled: true
IGMP Proxy debug: true
=== IP Link and Route ===
17: iptv@eth1: <BROADCAST,MULTICAST,UP,LOWER_UP> mtu 1500 qdisc noqueue state UP group default qlen 1000
    inet 10.210.65.169/22 brd 10.210.67.255 scope global iptv
       valid_lft forever preferred_lft forever
10.210.64.0/22 proto kernel scope link src 10.210.65.169
213.75.112.0/21 via 10.210.64.1 metric 217
=== Service Logs ===
Dec 07 22:43:23 UXG-Lite udm-iptvd[11151]: DEBUG[group_source_specific_timer_handler@718]: Enter
Dec 07 22:43:23 UXG-Lite udm-iptvd[11151]: DEBUG[send_igmp_mld_query@101]: src = 192.168.2.1 dst = 224.0.251.137
Dec 07 22:43:23 UXG-Lite udm-iptvd[11151]: DEBUG[send_igmp_mld_query@104]: max_len = 1476
Dec 07 22:43:23 UXG-Lite udm-iptvd[11151]: DEBUG[send_igmp_mld_query@115]: g = 224.0.251.137
Dec 07 22:43:23 UXG-Lite udm-iptvd[11151]: DEBUG[send_igmp_mld_query@155]: igh_len  = 8
Dec 07 22:43:23 UXG-Lite udm-iptvd[11151]: DEBUG[group_source_specific_timer_handler@786]: REMOVE
Dec 07 22:43:23 UXG-Lite udm-iptvd[11151]: DEBUG[imp_check_timer@171]: continue............
Dec 07 22:43:23 UXG-Lite udm-iptvd[11151]: DEBUG[main@653]: Data arrive
Dec 07 22:43:23 UXG-Lite udm-iptvd[11151]: DEBUG[mcast_recv_igmp@748]: src addr = 192.168.2.12
Dec 07 22:43:23 UXG-Lite udm-iptvd[11151]: received interface  14

**Comment by dmutsaers** [comment]
Goodmorning,

I see @fabianishere has updated udm-iptv to 3.0.4 on 11-12-2023. Did anyone try the new version?

Add support for UXG-Lite
https://github.com/fabianishere/udm-iptv/commit/fd6c501abb3336a7de3bcaef450b4417b35e8b19

**Reply by Lenz-art** [reply]
I tested it on my UXG_lite with new script from fabian seems to work.  Multicast streams working now 

root@UXG-Lite:~# udm-iptv diagnose
Please share the following output with the developers:
=== Configuration ===
WAN Interface: eth1
WAN VLAN: 4 (dev iptv)
WAN DHCP: true (options "-O staticroutes -V IPTV_RG")
WAN Ranges: 213.75.0.0/16  217.166.0.0/16
LAN Interfaces: eth0.4
IGMP Proxy quickleave disabled: true
IGMP Proxy debug: true
=== IP Link and Route ===
17: iptv@eth1: <BROADCAST,MULTICAST,UP,LOWER_UP> mtu 1500 qdisc noqueue state UP group default qlen 1000
    inet 10.35.151.253/20 brd 10.35.159.255 scope global iptv
       valid_lft forever preferred_lft forever
10.35.144.0/20 proto kernel scope link src 10.35.151.253
213.75.112.0/21 via 10.35.144.1 metric 217
=== Service Logs ===
Dec 11 21:55:59 UXG-Lite udm-iptvd[15778]: DEBUG[imp_check_timer@171]: continue............
Dec 11 21:55:59 UXG-Lite udm-iptvd[15778]: DEBUG[main@653]: Data arrive
Dec 11 21:55:59 UXG-Lite udm-iptvd[15778]: DEBUG[mcast_recv_igmp@717]: k_get_rlif = 17 im_vif = 2
Dec 11 21:55:59 UXG-Lite udm-iptvd[15778]: DEBUG[imp_get_mfcc_ttls@168]: group 224.0.251.135 isn't interest in packet from 217.166.225.135
Dec 11 21:55:59 UXG-Lite udm-iptvd[15778]: DEBUG[main@653]: Data arrive
Dec 11 21:55:59 UXG-Lite udm-iptvd[15778]: DEBUG[mcast_recv_igmp@748]: src addr = 192.168.3.3
Dec 11 21:55:59 UXG-Lite udm-iptvd[15778]: received interface  14
Dec 11 21:55:59 UXG-Lite udm-iptvd[15778]: DEBUG[imp_input_report_v1v2@289]: group address 224.0.251.133
Dec 11 21:55:59 UXG-Lite udm-iptvd[15778]: DEBUG[main@653]: Data arrive
Dec 11 21:55:59 UXG-Lite udm-iptvd[15778]: DEBUG[mcast_recv_igmp@748]: src addr = 10.60.157.20

**Reply by mgiebels** [reply]
Works Fine here!
Much easier as the USG3

**Reply by dmutsaers** [reply]
Great! Now I have to wait for new UGX-Lite stock to arrive, it's out of stock now. 😉

**Comment by dmutsaers** [comment]
Does udm-iptvd use improxy or igmpproxy on the UXG-Lite? Just curious.

**Reply by locmer** [reply]
root       10922       1  0 Dec18 ?        00:00:05 improxy -d 5 -c /var/run/igmpproxy.iptv.conf

**Comment by locmer** [comment]
Step by step on how I got it to work in UXG Lite with KPN (4k Arris TV 5502) 17 december 20023

ssh to device (Network, Settings, System, Advanced, Device authentication: to find the ssh user and password)

ssh username@ip-address of the UXG Lite. Paste the password.

You need (early access) firmware 3.1.16. The current 3.1.15 is not working (this may change in the future as newer version may come out). This installs 3.1.16:

```
ubnt-systool fwupdate
https://fw-download.ubnt.com/data/unifi-firmware/198c-UXG-3.1.16-168a7858-825a-4a20-b88e-dce8559deae2.bin

```
See at the bottom an error that I go that didn't seem to matter (1)

switch off "auto update" in the UI otherwise next night 3.1.15 is back on the UXG Lite, and you have to do this all again.

Install the magic bits

`sh -c "$(curl https://raw.githubusercontent.com/fabianishere/udm-iptv/master/install.sh -sSf)"
`
See at the bottom an error that I go that didn't seem to matter (2)

Go through the install, the install give one error that can be ignored.

- KPN (NL)
- [*] LAN [IPv4: 10.10.10.1] (The only option available)


I used vi to edit the /etc/udm-iptv.conf. The line I had to change is:

`IPTV_LAN_INTERFACES="eth0.20"
`
 as I have my IPTV on VLAN 20.

I think this line said `<br0>` is the default file.

-----
```
root@UXGLite:~# cat  /etc/udm-iptv.conf
## Example configuration for udmp-iptv ##
# Interface on which IPTV traffic enters the router
IPTV_WAN_INTERFACE="eth1"
# ID of VLAN which carries IPTV traffic (use 0 if no VLAN is used)
IPTV_WAN_VLAN="4"
# Name of the IPTV VLAN interface
IPTV_WAN_VLAN_INTERFACE="iptv"
# IP ranges from which the IPTV traffic originates (separated by spaces)
IPTV_WAN_RANGES="213.75.0.0/16  217.166.0.0/16"
# DHCP options to send when requesting an IP address
IPTV_WAN_DHCP_OPTIONS="-O staticroutes -V IPTV_RG"
# LAN interfaces on which IPTV should be made available
IPTV_LAN_INTERFACES="eth0.20"
# Disable quickleave for igmpproxy
IPTV_IGMPPROXY_DISABLE_QUICKLEAVE="false"
# Enable debugging for igmpproxy
IPTV_IGMPPROXY_DEBUG="true"
IPTV_IGMPPROXY_PROGRAM="improxy"

IPTV_IGMPPROXY_IGMP_VERSION="2"
root@UXGLite:~#
```

------

After editting file do: 

`udm-iptv restart
`
Incase you need to redo the config of udm-iptv use this:

`udm-iptv reconfigure
`
Please mind you also may need to re-edit the /etc/udm-iptv.conf 

This will show you all the network interfaces.

`ifconfig
`
As the last step I disabled all VLAN except VLAN 20 on the switch ports that have an 4k IPTV Arris VIP5502 from KPN.
And for this VLAN IGMP snooping is enabled. May be this is not needed.

Hope this helps someone.


----

Errors that I got that can be ignored (it seems):

1. During Firmware install

(INFO[0012] Failed to extract updater from firmware [/var/tmp/fwupdate.EaqCnWQ2Ab]: Failed to fwextract updater from /var/tmp/fwupdate.EaqCnWQ2Ab to /tmp/fw-updater err=[exit status 255]


2. During udm-iptv install

/tmp/udm-iptv.config.ghJkpq: 145: .: cannot open /usr/lib/udm-iptv/profiles/kpn.profile: No such file
udm-iptv failed to preconfigure, with exit status 2

**Comment by dmutsaers** [comment]
Hi,

I get the following error (iptv on internal vlan 2). However, everything seems to be working fine:

Dec 26 21:20:41 UniFiNext-GenGatewayLite udm-iptvd[53187]: Starting IGMP Proxy
Dec 26 21:20:41 UniFiNext-GenGatewayLite IMPROXY[53187]: ERROR[init_interface@172]: SIOCGIFADDR filed eth0
Dec 26 21:20:41 UniFiNext-GenGatewayLite udm-iptvd[53187]: init_interface: Cannot assign requested address

I assume I need this patch "Add support for UXG Lite LAN interfaces" ?
https://github.com/fabianishere/udm-iptv/pull/291

**Comment by peter-imagem** [comment]
> Step by step on how I got it to work in UXG Lite with KPN (4k Arris TV 5502) 17 december 20023
> 
> ssh to device (Network, Settings, System, Advanced, Device authentication: to find the ssh user and password)
> 
> ssh username@ip-address of the UXG Lite. Paste the password.
> 
> You need (early access) firmware 3.1.16. The current 3.1.15 is not working (this may change in the future as newer version may come out). This installs 3.1.16:
> 
> ```
> ubnt-systool fwupdate
> https://fw-download.ubnt.com/data/unifi-firmware/198c-UXG-3.1.16-168a7858-825a-4a20-b88e-dce8559deae2.bin
> ```
> 
> See at the bottom an error that I go that didn't seem to matter (1)
> 
> switch off "auto update" in the UI otherwise next night 3.1.15 is back on the UXG Lite, and you have to do this all again.
> 
> Install the magic bits
> 
> `sh -c "$(curl https://raw.githubusercontent.com/fabianishere/udm-iptv/master/install.sh -sSf)" ` See at the bottom an error that I go that didn't seem to matter (2)
> 
> Go through the install, the install give one error that can be ignored.
> 
> * KPN (NL)
> * [*] LAN [IPv4: 10.10.10.1] (The only option available)
> 
> I used vi to edit the /etc/udm-iptv.conf. The line I had to change is:
> 
> `IPTV_LAN_INTERFACES="eth0.20" ` as I have my IPTV on VLAN 20.
> 
> I think this line said `<br0>` is the default file.
> 
> ```
> root@UXGLite:~# cat  /etc/udm-iptv.conf
> ## Example configuration for udmp-iptv ##
> # Interface on which IPTV traffic enters the router
> IPTV_WAN_INTERFACE="eth1"
> # ID of VLAN which carries IPTV traffic (use 0 if no VLAN is used)
> IPTV_WAN_VLAN="4"
> # Name of the IPTV VLAN interface
> IPTV_WAN_VLAN_INTERFACE="iptv"
> # IP ranges from which the IPTV traffic originates (separated by spaces)
> IPTV_WAN_RANGES="213.75.0.0/16  217.166.0.0/16"
> # DHCP options to send when requesting an IP address
> IPTV_WAN_DHCP_OPTIONS="-O staticroutes -V IPTV_RG"
> # LAN interfaces on which IPTV should be made available
> IPTV_LAN_INTERFACES="eth0.20"
> # Disable quickleave for igmpproxy
> IPTV_IGMPPROXY_DISABLE_QUICKLEAVE="false"
> # Enable debugging for igmpproxy
> IPTV_IGMPPROXY_DEBUG="true"
> IPTV_IGMPPROXY_PROGRAM="improxy"
> 
> IPTV_IGMPPROXY_IGMP_VERSION="2"
> root@UXGLite:~#
> ```
> 
> After editting file do:
> 
> `udm-iptv restart ` Incase you need to redo the config of udm-iptv use this:
> 
> `udm-iptv reconfigure ` Please mind you also may need to re-edit the /etc/udm-iptv.conf
> 
> This will show you all the network interfaces.
> 
> `ifconfig ` As the last step I disabled all VLAN except VLAN 20 on the switch ports that have an 4k IPTV Arris VIP5502 from KPN. And for this VLAN IGMP snooping is enabled. May be this is not needed.
> 
> Hope this helps someone.
> 
> Errors that I got that can be ignored (it seems):
> 
> 1. During Firmware install
> 
> (INFO[0012] Failed to extract updater from firmware [/var/tmp/fwupdate.EaqCnWQ2Ab]: Failed to fwextract updater from /var/tmp/fwupdate.EaqCnWQ2Ab to /tmp/fw-updater err=[exit status 255]
> 
> 2. During udm-iptv install
> 
> /tmp/udm-iptv.config.ghJkpq: 145: .: cannot open /usr/lib/udm-iptv/profiles/kpn.profile: No such file udm-iptv failed to preconfigure, with exit status 2

Thanks! I tried the same with my UXG Lite, using eth0.4 as VLAN. I get the following error in the diagnose command:

```
Please share the following output with the developers:
=== Configuration ===
WAN Interface: eth1
WAN VLAN: 4 (dev iptv)
WAN DHCP: true (options "-O staticroutes -V IPTV_RG")
WAN Ranges: 213.75.0.0/16  217.166.0.0/16
LAN Interfaces: eth0.4
IGMP Proxy quickleave disabled: false
IGMP Proxy debug: true
=== IP Link and Route ===
21: iptv@eth1: <BROADCAST,MULTICAST,UP,LOWER_UP> mtu 1500 qdisc noqueue state UP group default qlen 1000
    inet 10.198.56.17/20 brd 10.198.63.255 scope global iptv
       valid_lft forever preferred_lft forever
10.198.48.0/20 proto kernel scope link src 10.198.56.17 
213.75.112.0/21 via 10.198.48.1 metric 221 
=== Service Logs ===
Dec 29 22:08:01 UniFiGateway udm-iptvd[519182]: udhcpc: sending discover
Dec 29 22:08:01 UniFiGateway udm-iptvd[519182]: udhcpc: sending select for 10.198.56.17
Dec 29 22:08:01 UniFiGateway udm-iptvd[519182]: udhcpc: lease of 10.198.56.17 obtained, lease time 3600
Dec 29 22:08:01 UniFiGateway udm-iptvd[519169]: NATing IPTV network ranges (if necessary)
Dec 29 22:08:01 UniFiGateway udm-iptvd[519169]: Creating static routes (if necessary)
Dec 29 22:08:01 UniFiGateway udm-iptvd[519169]: Setting up IGMP Proxy
Dec 29 22:08:01 UniFiGateway udm-iptvd[519169]: Using improxy...
Dec 29 22:08:02 UniFiGateway udm-iptvd[519169]: Starting IGMP Proxy
Dec 29 22:08:02 UniFiGateway IMPROXY[519169]: ERROR[init_interface@172]: SIOCGIFADDR filed eth0
Dec 29 22:08:02 UniFiGateway udm-iptvd[519169]: init_interface: Cannot assign requested address
```

Anyone knows how to solve this?

**Reply by dmutsaers** [reply]
Hi @peter-imagem ,
I receive the same error message, but everything seems to work without problems. However, it would be nice to get rid of the error message.
See https://github.com/fabianishere/udm-iptv/discussions/286#discussioncomment-7951322

**Comment by peter-imagem** [comment]
I noticed a new setting, "IGMP Proxy" in my networksettings (see image), once I activate this option the freezes are gone and the error messages in the log are also gone. I use a UXG Lite with software version 3.1.16.

```
=== Configuration ===
WAN Interface: eth1
WAN VLAN: 4 (dev iptv)
WAN DHCP: true (options "-O staticroutes -V IPTV_RG")
WAN Ranges: 213.75.0.0/16  217.166.0.0/16
LAN Interfaces: eth0.661
IGMP Proxy quickleave disabled: true
IGMP Proxy debug: true
=== IP Link and Route ===
21: iptv@eth1: <BROADCAST,MULTICAST,UP,LOWER_UP> mtu 1500 qdisc noqueue state UP group default qlen 1000
    inet 10.198.56.17/20 brd 10.198.63.255 scope global iptv
       valid_lft forever preferred_lft forever
10.198.48.0/20 proto kernel scope link src 10.198.56.17 
213.75.112.0/21 via 10.198.48.1 metric 221 
```


<img width="1145" alt="Scherm­afbeelding 2023-12-30 om 12 28 55" src="https://github.com/fabianishere/udm-iptv/assets/59958886/a30b0e61-f98f-4fc4-aaad-9a1976e6ecba">

**Reply by dmutsaers** [reply]
@peter-imagem 
I believe the default IGMP Proxy doesn't support IPTV on a separate WAN VLAN.
"UNA 7.4.140 contains IGMP Proxy"
https://github.com/fabianishere/udm-iptv/issues/223#issuecomment-1426761441
